Article ID,Newspaper Title,Newspaper City,Newspaper Province,Newspaper Country,Year,Month,Day,Article Type,TextID26,Glasgow Advertiser,Glasgow,Scotland,United Kingdom,1789,11,23,inform,Trade is reviving in America to a very great degree –and such is the appearance of things that in a very few years we may expect to see as firm an union of mercantile interests betwixt this country and the United States as ever subsisted. It is in vain to instil prejudices against Great Britain in the mind of an American merchant ; he knows this to be the ready-money market and he will come to it accordingly.  ID48,Glasgow Advertiser,Glasgow,Scotland,United Kingdom,1789,12,18,persuade,The Minister is now said to be employed in drawing up two plans which will give rise to very warm debates in Parliament : one is for settling a commercial arrangement between Great Britain and Ireland ; the other for giving a constitution to Canada. In feeling the former the Minister will have to contend with strong commercial prejudices; in the latter he will have to encounter religious principles. The British settlers in Canada are comparatively few in number. The great bulk of the Canadians are the descendants of French and are Roman Catholics. The former are Protestants. Fleaury in france and Walpole in England were not fonder of peace than Mr. Pitt. Conquests may be made by war but consequence and wealth can only be obtained by a pacific system if the first commercial nation in the world. Besides these considerations the grand secret has been discovered since the present Minister came into power that the best riddance England ever had was of her American Colonies ; because by this means she becomes thoroughly collected at home to oppose every foreign power without the expence and blood of supporting the Americans at the same time that they cannot do without BRitish manufactures in one line or another. Thus they are under the necessity of protecting themselves at the same time that like the rest of Europe they are obliged to resort to our superior mercantile market. Application has been lately made to the Lords of the Treasury for an order on the Bank to issue some of the new silver coin in aid of the present want of silver for circulation the scarcity of which is much felt by retail traders in particular.  ID68,Glasgow Advertiser,Glasgow,Scotland,United Kingdom,1790,07,09,inform,We have this day received Quebec newspapers down to the 24th May from which the following is extracted:– Quebec May 20. We hear late accounts from Niagara mention that the Indians in that quarter are much alarmed in consequence of a message said to be received by them from the States that they had now raised an army to take their own for Niagara and that two thousand men of that army were now on their way from New York–desiring the Indians to lye still and look on and that they would punish those that should interfere. It was also said that the people of New York were determined of themselves to lay open the post of Oswego and that emissaries had been employed to persuade the Indians they would be greatly benefited by that event. We are rather inclined to believe the Indians are too sensible of the great benefits already conferred upon them by our neighbours in buying their lands from them to think of accepting any more from that quarter and we would recommend it to the new-born Sovereignty on this side the Atlantic before they testify their impatience that national treaties like private agreements are not to be infringed by one and performed by the other party–Pay and you shall receive. [As to the Americans making an attempt upon Niagara they have long had it in contemplation to get possession of our posts upon the lakes in Canada.] May 24. The concerned in the ship Columbia and sloop Washington have received letters from the Captain Kendrick dated at Nootka in July last; he informs them that he passed the winter preceding on the north-west coast of America; that he was then bound on a voyage further northward and from thence intended to proceed to Canton.– The letters were forwarded to Mexico by a Spanish fleet that had been at Nootka and from thence to the Spanish Charge des Affaires at New York. They were covered to the President of the United States of America. [From what appeared in our paper of Friday last (see Glasgow Intelligence p. 424 ) and what is mentioned above it seems very probable that the affair of Nootka Sound had been a preconcerted scheme between the Americans and Spaniards as Capt. Kendrick addresses his dispatches for the President of the States without making the least mention (from what is made public) of any British ships being then at Nootka Sound.]  ID94,Glasgow Advertiser,Glasgow,Scotland,United Kingdom,1793,07,22,inform,Philadelphia June 1. We are informed that in consequence of instructions from the Executive Council of the United States to the Attorney for the District of Penn sylvania prosecutions have been instituted against John Singleterry and Gideon Henfield charged with violating their duty as Citizens of the United States entering on board the armed schooner Genet in the service of France and with others on board the said schooner capturing several vessels the property of the subjects of his Britannic Majesty and otherwise annoying the trade and commerce of the said subjects contrary to the Laws of Nations and the Treaty of Peace subsisting between the United States and his said Britannic Majesty. The above named persons have been committed to the goal of the County of Philadelphia to take their trial at the next Circuit Court of the United States. A letter from Charleston dated May 10 says Yesterday evening a gentleman arrived here from Augusta in Georgia who informs that six of the Creek Towns with a number of Cherokees had declared war against the United States and were actually marching under the command of Bowles and Gilpin at attack the frontiers.  ID104,Caledonian Mercury,Edinburgh,Scotland,United Kingdom,1812,08,29,inform,Montreal July 4 This city has been for a few days past in a state of agitation occasioned by an event which has taken place at Pointe Claire ; and as this matter will be clothed no doubt in all the dress of misrepresentatation by our neighbouring enemies from the information they may receive of it we consider it a duty we owe to the community at large in this country to state the circumstances as they occurred in a fair open and candid manner. By the late militia law 2000 young men are to be drafted from the general militia of the province for three months to be properly trained and of course a certain proportion of this number is to be furnished by each particular district. Some those drafted from the Parish of Pointe Claire refused to march to Lapraire for the purpose of joining the division stationed there ; in consequence of which Major Leprohon belonging to this particular battalion was sent on Tuesday last with 22 attendants to apprehend these refractory persons as deserters. They apprehended four with some opposition ; and on their way to town with them they were followed by a considerable number of persons who rescued one prisoner and threatened that they would next day proceed to the depot at Lapraire and bring away by force from thence the young men of the parish who were there on duty. Accordingly on Wednesday a large body of these people assembled at La Chine with the intention of carrying their threats into execution. Thomas M'Cord Esq. one of the Police Magistrates about four o'clock in the afternoon left town accompanied by the light infantry of the 49th regiment and a detachment of the royal artillery with two field-pieces under the command of Major Plenderleath and took post on a point opposite to the insurgents (consisting of about 400 persons 87 of whom appeared to be armed) and at the distance[?] of about two acres. Mr M'Cord with some other respectable citizens pointed out the impropriety of their conduct and the fate that would unfortunately await their perseverance ; urging them by every persuasion to disperse and return peaceably to their horses and obey the law. They replied that they did not consider the militia bill as fully passed–that they were informed it had not received the Royal sanction ; and that although it might have passed the House of Assembly where it originated it had not obtained the approbation of the other branches of the Legislate ; that the law if really enacted had not been promagated amongst them and that they were not properly made acquainted with it ; as such they could not pay obedience to it. Under this false and unfortunate impression these deluded people persisted ; but at the same time declared with shouts of Vive le Roi that if the Government wanted their services at any time they were ready one and all to come forward with their lives in the defence of their country and that they would prove themselves in the hour of danger to be faithful subjects to a Government to which they were firmly attached by every principle. Finding however that they still persisted in their determination on this particular object Mr M'Cord in his Magisterial capacity read the riot act to them and ordered them to disperse ; which not being complied with a round shot was fired by the artillery but elevated above injury which was returned by the insurgents in a spirited fire with ball deserving of a better cause. The troops then fired a volley with ball and grape but still too much elevated to do any harm which was also returned by another discharge from the mob upon which a few direct shots were fired at them (it being nearly dark) by the military which made them disperse and one man was found killed and another wounded it is feared mortally.  ID105,Caledonian Mercury,Edinburgh,Scotland,United Kingdom,1812,10,03,inform,Upper Canada York July 28. Yesterday at an early hour his Honour Isaac Brock Esq. administering the Government of Upper Canada and Major-General commanding his Majesty's forces therein arrived at this place from Fort-George and accompanied by a numerous suite proceeded to the Government Building at four p.m. when he opened the present extra session of the Legislature and delivered the following speech to both houses :– Honourable Gentlemen of the Legislature Council and Gentlemen of the House of Assembly The urgency of the present crisis is the only consideration which would have induced me to call you together at a time when public as well as private duties elsewhere demand your care and attention. But Gentlemen when invaded by an enemy whose avowed object is the entire conquest of this province the voice of loyalty as well as of interest calls aloud to every person in the sphere in which he is placed to defend his country. Our militia have heard that voice and have obeyed it ; they have evinced by the promptitude and loyalty of their conduct that they are worthy of the King whom they serve and of the constitution which they enjoy ; and it affords me particular satisfaction that while I address you as Legislators I speak to mean who in the day of danger will be ready to assist not only with their counsels but with their arms. We look Gentlemen to our militia as well as to the regular forces for our protection ; but I should be wanting to that important trust committed to my care if I attempted to conceal (what experience the great instructor of mankind especially of legislators has discovered) that amendment in our militia laws is necessary to render them efficient. It is for you to consider what further improvements they still may require. Honourable Gentlemen of the Legislative Council and Gentlemen of the House of Assembly From the history and experience of our mother country we learn that in times of actual invasion or internal commotion the ordinary course of criminal laws has been found in adequate to secure his Majesty's Government from private treachery as well as from open disaffection ; and that at such times its Legislature has found it expedient to enact laws restraining for a limited period the liberty of individuals in many cases where it would be dangerous to expose the particulars of the charge ; and although the actual invasion of the province might justify me in the exercise of the full power reposed in me on such an emergency yet it will be more agreeable to me to receive the sanction of the Houses. A few traitors have already joined the enemy–have been suffered to come into the country with impunity–and have been harboured and concealed in the interior ; yet the general spirit of loyalty which appears to pervade the inhabitants of this province is such as to authorise a just expectation that their efforts to mislead and deceive will be unavailing– The disaffected I am convinced are few–To protect and defend the loyal inhabitants from the machinations is an object worthy of your most serious deliberations. The speech concludes with a call for supplies. Proclamation The unprovoked declaration of war by the United States of America against the united kingdom of Great Britain and Ireland and its dependencies has been followed by the actual invasion of this province in a remote frontier of the western districts by a detachment of the United States. The officer commanding that detachment has thought proper to invite his Majesty's subjects not merely to a quiet and unresisting submission but insults them with a call to seek voluntarily the protection of his Government. Without condescending to repeat the illiberal epithets bestowed in this appeal of the American Commander to the people of Upper Canada on the administration of his Majesty every inhabitant of the province is desired to seek the confutation of such indecent slander in the review of his own particular cirumstances. Where is the Canadian subject who can truly affirm to himself that he has been injured by the Government in his person his property or his liberty? Where is to be found in any part of the world a growth so paid in prosperity and wealth as this colony exhibits? Settled not thirty years by a band of veterans exiled from their former possessions on account of their loyalty not a descendant of these brave people it to be found who under the fostering liberality of their Sovereign has not acquired a property and means of enjoyment superior to what were possessed by their ancestors. This unequalled prosperity would not have been attained by the utmost liberality of the Government or the persevering industry of the people had not the maritime power of the mother country secured to its colonists a safe access to every market where the produce of their labour was in request. The unavoidable and immediate consequence of a separation from Great Britain must be the loss of this inestimable advantage and what is offered to you in exchange? To become a territory of the United States and share with them that exclusion from the ocean which the policy of their Government enforces ; you are not even flattered with a participation of their boasted independence ; and it is but too obvious that once exchanged from the powerful protection of the United Kingdom you must be re-annexed to the dominion of France from which the provinces of Canada were wrested by the arms of Great Britain at vast expence of blood and treasure from no other motive than to relieve her ungrateful children from the oppression of a cruel neighbour ; the restitution of Canada to the empire of France was the stipulated reward for the aid afforded to the revolted colonies now the United States ; the debt is still due and there can be no doubt but the pledge has been renewed as a consideration for commercial advantages or rather for an expected relaxation in the tyranny of France over the commercial world. Are you prepared inhabitants of Canada to become willing subjects or rather slaves to the despot who rules the nation of Europe with a rod of iron? If not arise in a body exert your energies co-operate cordially with the King's regular forces to repel the invader and do not give cause to your children when groaning under the oppression of a foreign master to reproach you with having too easily parted with the richest inheritance of this earth–a participation in the name character and freedom of Britain. [The proclamation concludes with a declaration that should the Americans refused quarter in consequence of Indians being found in Canadian ranks that a severe and rigorous retaliation will take place.] Isaac Brock Major-Gen. and President Head-quarters Fort George July 22 1812.  ID107,Caledonian Mercury,Edinburgh,Scotland,United Kingdom,1812,11,09,inform,Extract of a letter from Montreal Sept. 25 Our Friend Mr – arrived in town from New York a few days ago. On his way he passed three days at Plattsburgh the head-quarters of the American army which from ocular observation he states to consist of 8 or 10000 men under the command of General Bloomfield Mooar and Petit. This force is composed of 3 or 4000 regulars about the same number of militia and some volunteers from the southward. The militia is almost all from the state of New York for the Yankees still refuse to march. with this force no doubt is entertained here but they will make an attack ; and if they mean to make it this season they must be prompt in their movements for the weather is getting cold and they are not well clothed or appointed. Mr – indeed states half of them to be without shoes or stockings which will never do for a winter campaign in this country. To repel the threatened attack we are making every preparation in our power and the Canadians seem well disposed to second the Government. Sir George Prevost has established a cordon the left of which is at Chambly and extending to Chateaguny ; the main encampment is half way between St John's and La Prairie. Colonel Murray is at St John's with a battalion ; and the Isle-auNoix is strongly fortified with a boom and a chain secured across the river. This line of defence is composed of four regiments of the line and 2000 drafted militia with a corps of about 400 Canadian voltigeurs raised last spring. The Royals a very strong battalion lately arrived from the West Indies are now marching to join the camp. The citizens both here and at Quebec mount guard and do garrison : indeed there are in this island (Montreal) five battalions of militia say 3 to 4000 men pretty well disciplined and who on an alarm could march to this cordon in half a day.– A new regiment of embodied militia has lately been formed by drafts from the different regiments of inrolled militia in this island and old Major Murray is appointed Lieutenant-Colonel. The gentlemen of the North-west Company army are forming a corps of their voyageurs who will be most useful troops to act in advance with the Indians. The number originally proposed was 200 but the men have come forward so handsomely that they are to consist of 500. Mr M'Gillivray is Lieutenant-Colonel Commandant of this corps Mr Shaw Major and the other partners of the Company are Captains and subalterns ; so that the men being commanded by those whom they have accustomed to obey may be considered as already disciplined at least in point of subordination. Sir George confines his operations to mere defence. La Motte with about 70 Indians advanced through the woods about ten days ago within hearing of this redoubtable army and set up a war whoop which so completely terrified them that though they could see no enemy they lay on their arms for two two successive nights in no expectation of an attack–to prevent which they cut down their best bridge and destroyed all the roads by which I suppose they mean to invade us. Mr – who was several days at their headquarters and who was offered the rank of Lieutenant-Colonel in the army has it is said proposed to Sir George to destroy their camp with 500 men ; and Sir George is said to have replied that his plan was fixed not to make any attack nor to send a man across the line. This forebearance which the Yankees impute to fear or weakness tends only to increase their insolent swaggering and their enmity is to inveterate to be allayed by any thing but hard knocks.  ID108,Caledonian Mercury,Edinburgh,Scotland,United Kingdom,1813,10,16,inform,The Rota frigate arrived on Monday off Plymouth with a fleet from Halifax under convoy and passed up the channel with the chief part of the trade. From the Hydra transport which put into Plymouth we have received the following official notification of Sir James Yeo's success on Lake Ontario the American notices of which have already been published. Bulletin. Head-quarters Kingston Aug. 14. 1813 By accounts received from his Excellency the Governor in Chief and Commander of the forces from Commodore Sir James Yeo dated off York half-past one P.M. on the 11th instant the following particulars have been transmitted of the capture and loss of the enemy's armed schooners:– On Thursday evening last the 10th instant the enemy's squadron under the Command of Commodore Chauncey got under weigh from their anchorage off the mouth of Niagara River and with a fine breeze from the east stood towards our fleet which were becalmed off the port of Twelve Mile Creek. At sun-set a breeze coming off the land gave us the wind of the enemy when our squadron stood for them on which immediately bore away from us under as much sail as their schooners could carry to keep up with their larger vessels. The enemy's fleet formed a long. The Pike Madison Oneida and six schooners (two schooners were placed to windward for the purpose of raking the masts of our squadron as it should come up). At eleven the squadron got within gun-shot of the schooners when they opened a brisk fire and from their going so fast it was more than an hour before the Wolf our headmost ship could pass them ; at this time the rest of the squadron was two and three miles astern of the Wolf and on her coming up with the Madison and Pike they put before the wind and made sail firing their stern-chasers.– Sir J. Yeo finding it impossible to get the squadron up with the enemy as the Wolf was the only ship which could keep up with them then made sail between them and the two schooners to windward which he captured and which are called the Julia and Growler each carrying one long 32pounder and long 12-pounder and 40 men.– Two of the enemy's largest schooners the Scourge of 10 and Hamilton of nine guns upset on the night of the 9th in carrying sail and all on board perished (about 100 in number). By this loss and capture the enemy's squadron are reduced to 10 vessels and our's increased to eight. It is ascertained that the Pike mounts 28 long 24-pounders and 420 men the Madison 22 long 32 pounders and 340 men. Boat loads of troops were taken on board the enemy's squadron on Monday last for the purpose it is supposed of repelling the boarders.– The Wolf has not received any material injury and not a person hurt. The prisoners were landed on the 11th instant and the Growler's damage repaired. She had lost her bowsprit and was otherwise cut up. Nothing could exceed the eagerness and enthusiasm of the officers and men in our squadron for a close engagement.  