Article ID 	Newspaper Title 	Newspaper City 	Newspaper Province 	Newspaper Country 	Year 	Month 	Day 	Article Type 	Text 	Keywords
        ID169Aberdeen JournalAberdeenScotlandUnited Kingdom18200712informMaritime Intelligence The Jane, Drummond, of Liverpool arrived at Savannah, was plundered on the 22d April in [?], 34, 10. long. 41. 21. of all her specie, 20,500 dollars, stores, provisions, &c. by a Spanish ship, of 300 tons, armed with 14 guns and two stern chasers, and full of men. She was supposed to have been out two or three months from Cuba. She had a yellow waist, woman head, painted black, and was coppered to light water mark. Intelligence from Marseilles, dated 22d inst. states –' An English Captain, who left Oran on the 13th inst. and arrived yesterday in this port, has declared that a squadron of five armed ships, which he was assured were destined for the North Seas, sailed from Algiers at the beginning of the present month. A vessel, the Prompt sailed on Tuesday evening from Greenock for Quebec, having on board emigrants from Anderston, Rutherglen, Lesmahogow, and Lanark, to the number of about 350 persons. The Rev. Mr Easton, of Montreal, goes out with the Prompt. The Hibernia, M'Eachren, from the Clyde to Buenos Ayres, was totally lost the 15th April, near Maldonado. Crew saved. Discovery of a New Island off Cape Horn A new island has been discovered off Cape Horn, in inst. 61 deg. long. 55 deg. by the ship William, on a voyage from Monte Video for Valparaiso. The same having been dispatched by Captain Sheriff, of the Andromache frigate, to survey the coast, had explored it for 200 miles. The captain went ashore found it covered with snow, and uninhabited. Abundance of seals an whales were found in its neighbourhood. He has named the island New Shetland. Accounts from Constantinople, dated May 26, annouce, that the armaments against Ali Pacha are upon the most formidable scale, and are actively pursued.– The latter has obtained hostages of his principal officers, as pledges of their fidelity. On the 14th, two new ships of the line were launched in the presence of the Sultan and his Grand Dignitaries, at the hour fixed by the chief astrologers. The navigation between Bagdad[?] and Bassurah has been free since the defeat of the Arabs by the English. The latter, it is stated, have facilitated the intercourse between those two places by the establishment of parket-boats. emigration and immigration;privateering;shipping;shipwreck;Ottoman Empire
        ID170Aberdeen JournalAberdeenScotlandUnited Kingdom18200712informColonial Intelligence Proposed New Monarchy in South America Accounts have beenreceived from Buenos Ayres, by the Blossom sloop of War, of a curious nature.– They relate to a project said to have been in agitation for placing a Prince of the House of Bourbon at the head of an independent Sovereignty on the River Plate.– The circumstance has been brought to light by the late changes in the Government of Buenos Ayres. From the documents now published, and received by the Blossom, it appears that in June, 1819. Gomez the Envoy from Buenos Ayres, at Paris, was invited to a conference by M. De Cazes, then French Minister for Foreign Affairs, the object of which was to communicate a project of the French Cabinet for the colonsolidation of the Independent Government of South America. This project, the French Minister observed, would meet with the decided approbation of the Continental Powers, especially Russia and Austria. Great Britain might not like it, but yet would not find any good pretence for resisting it ; and his Catholic Majesty would yield to the influence of all Europe with the better grace, as his former dependencies would be only transferred to a branch of his own family. The King of France would furnish assistance of every king, and employ every means, even to the supply of troops, for carrying the affair into execution. On the 26th of October last, when the statement of his conference reached Buenos Ayres, Rondeau, then Director ad interim made a secret communication to the Congress, and transmitted to them the letter of the Envoy, together with the French memorial ; on the following day, and on the 3d of November, the matter was discussed in secret meetings, and the result was an[?] opinion, that the Constitution lately-sworn allowed no alteration to be made in the form of Government till after the meeting of the Chambers. That a branch of the Bourbon family, so closely connected with the reigning Monarch of Spain, was in itself an insuperable objection, as also the consideration that the Prince proposed and supported by the Powers of the European Continent, would naturally more incline towards the views of his protectors than towards those of South America, which ought to avoid all connexion with European continental politics ; and that Great Britain was the power from which South America had most to fear, and most to expect. It was at the same time suggested, that the Envoys in Europe shoud put the communications from Paris into the hands of the British Minstry, whose good opinion and protection South America is most anxious to conciliate. Our Cabinet has always treated the South Americans with the greatest reserve, as if feating contamination by simple contact–a delicacy towards Spanish interests and feelings which appears in itself commendable, but, when measured by the standard of national benefit, may not merit the same praise. As it is, it would seem that the British interest is likely to gain the ascendacy in the river Plate, rather through the disposition of the inhabitants, than from any influence exerted by our Ministers. We shall only add, that thought the negotiation was carried on by the Duke de Cazes, the project did not originate with him, and did not at first apply to the Prince de Lucca. It was intended as an opening for one more nearly allied to the reigning family in France. undefined
        ID171Aberdeen JournalAberdeenScotlandUnited Kingdom18200719informEmigration. We extract the following statement from the Montreal Herald and an important one it is, to those who are desirous of emigrating, as well as to those, who, from patriotic motives, would wish to turn the tide of emigration into a channel which, while it relieve the mother country now, may hereafter add to her strength and resources : Number of British subjects that emigrated to the United States, who received recommendations for grants of land, and removed to the province of Upper Canada, from James Buchanan, Esq. his Majesty's Consul at New York, in the year 1819 : – English { Farmers..... 180 Women..... 118 Children..... 157 Mechanics..... 117 Women..... 57 Children..... 92 } 1021 Scotch { Farmers..... 50 Women..... 11 Children..... 15 Mechanics..... 30 Women..... 9 Children..... 36 } 131 Irish { Farmers..... 184 Women..... 94 Children..... 319 Mechanics..... 75 Women..... 42 Children..... 98 } 810 Total.........1962 We cannot give publicity to the above return, without observing how eminently calculated such a document is, to open the eyes of our too credulous, yet industrious and loyal countrymen ; many of whom are still disposed to look to the United Statesm, as the abode of independence and the source of affluence. Here we see nearly 2000 British subjects, who, in one season, through the agency alone of one of our Consuls(withoutany pecuniary aid), have removed from the United States to Upper Canada. Their trieal and failure in the former, as well as the trial and failure of the great numbers who have returned to this country, are circumstances well calculated to direct the attention of those who have emigration in view, at once to Upper Canada. We have made enquiry about these hitherto unknown, but truly fertile regions ; and we are informed from a most authentic and satisfactory source, that there there are unlocated lands, fertile beyond the conception of those who have not seen them, capable of receiving ten millions of inhabitants ; that the winters are not so cold, nor the summers so hot, as in the State of New York ; that these regions have proved eminently healthy to the vast numbers that have poured into them of late years ; and that the administration of the laws, the state of education and religious instruction, and above all, the peace and quiet of the inhabitants have found there, have exceed their most sanguine expectations. It may be desirable to state, that grown persons can get by water from Quebec to York, the capital of Upper Canada, for about 28s ; children, half price ; that to all persons properly recommended as to good conduct, a grant of land is given according to their means of cultivation ; that this grant becomes their own for ever, and they may dispose of it as they please. undefined
        ID172Aberdeen JournalAberdeenScotlandUnited Kingdom18200802informColony at the Cape of Good Hope (Extract of a Letter, dated off Madeira ) Aurora Transport Ship, Feb 19. An opportunity having offered for transmitting a hasty account of the Aurora and Brilliant transports, proceeding with settlers to the Cape of Good Hope, I feel happy in availing myself of that circumstance, with a view as well to gratify our friends in England, as to add another confirmation of the liberality of Government in our important undertaking. First, it will be necessary to state, that the two ships sail in company, and are every day within hail of each other ; the former commanded by Captain Pearson, and the latter by Captain Bothwell, who is accompanied by Lieutenant Pritchard, as agent to both vessels. We sailed from Gravesend on. Our course down Channel was most favourable, and the weather has hitherto been propitious. No death, disease, or serious accident has occurred in either ship and blooming health and vigour now rapidly succeed the langour produced by a sudden transition to a new element. Provisions, consisting of flour, currants, suet[?] oatmeal, peas, butter, cheese, tea, sugar, biscuit, salt pork, and beef, of excellent quality, are liberally supplied, together with a proper allowance of rum, vinegar, mustard and spices. The ships are fitted up in every respect comfortably and commodiously, and the most perfect harmony prevails, if we except bickerings amongst the old women about fractured teapots and mislaid culinary articles. The attention paid to the comfort of the passengers, and more especially to that of the women and children, by the Captains, and the agent (Mr Pritchard), is highly creditable to the instructions received from Government. Although I do not sail in the same ship Captain Bothwell. I have had ample proofs of the kindness and humane liberality which he shews to the passengers in the Brilliant. Captain Pearson is an active, intelligent officer, who has been 23 years in the Transport Service under Government : he has sailed to almost every part of the world, and Algoa Bay, our place of destination, is quite familiar to him. It may be egotism to speak of myself; but I trust I may be excused in boasting, that of the crew and 240 passengers, not one is seriously indisposed at present, and wishing, with heartfelt sincerity, to my friends in England, happiness, peace, and tranquility, in as good health as I now enjoy, long may they live, long live the Constitution: and while on Fish River or Orange River we encounter the difficulties incident to new colonists, may England and South Africa be ever united by the ties of mutual friendship–the one affording her parental arms, and the other mindful of her filial duty. P. Campbell., Surgeon. undefined
        ID173Aberdeen JournalAberdeenScotlandUnited Kingdom18210117informColonial Intelligence We have received letters and papers, from the Cape of Good Hope, to the 22d October, and they are satisfactory in all points of view, but especially with reference to the new settlement at Algoa Bay. His Excellency, the Governor, Sir R. S. Donkin, was taking some effectual measures to place the coinage of the colony upon a better footing, and on the 13th of October he issued a Proclamation for destroying a very large quantity of base money. He has also taken measure to communicate to the new settlers from England the full benefit ofthe Courts of Justice esblished in that quarter of the world. We have received an account of the loss of the Abeona[?] transport, bound to the Cape of Good Hope, with settlers. The following is an extract of a letter from the Agent to Lloyd's, dated Lisbon, 20th Dec. The Condessa da Ponte, which arrived on the 20th inst. from Marenham[?], has brought 49 persons, who escaped from the Abeona transport, bound to the Cape of Good Hope, which took fire and was burnt on the 25th ult. in lat. 5 N. long–and 113 lives were lost. The Agent, Lieut. Madge, the Captain, Surgeon, 21 men, 16 boys, 4 women, and 5 girls, got into three boats, and fortunately fell in with the Condessa da Ponte, the morning after the fatal event. Demerara Gazettes to a late date have been received, which give detailed accounts of the number and state of the slaves in that part of the West Indies. The report is given by James Robertson, Esq. the new Slave Registrat of the United Colony. It is a triennial statement of the slave population, and the Reporter makes some judicious comparative remarks. It appears that there has been a large decrease of the number by deaths, but the Creoles are greatly increased as compared with the former year. Births have been in the proportion of one to forty-six. The Report defends the [?] of the West India Planters, and observes that the state of the Black population serves[?] to evil for little or no [?] ; so great is the kindness, the liberality, and induglent care of propiertors. It adds, that their own interests is a perpetual[?] evil[?] upon their humanity. In the colony there [?] [?] [?] [?] [?] [?] [?] [?] [?] slaves on the island, [?] Africans[?] and Creoles and there are 38,910 female slaves of the same donomination, making a total of 76,929. The slave population in 1817, amounted in the whole to 77,867.– The number of births which have occurred since that period is 5,317, and deaths 7,140. The Report concludes with some gratifying observations upon the flourishing state of the colony. undefined
        ID175Aberdeen JournalAberdeenScotlandUnited Kingdom18210131informColonial Intelligence Success of the Cutch Expedition against the Sindeans –The following extract of a letter from Bombay bringing this intelligence, we copy from Carrick's Post, which appears to have exclusive means of obtaining information on India affairs:– Bombay, Sept. 12, 1820. While I was seeing the last of your goods on board, last night, a vessel arrived in the harbour having on board an officer from Cutch, who was the hearer of the official intelligence of the complete success of Sir Charles Culville's expedition against the Sindeans. The expedition consisted of 12,000 men, commanded by his Excellency the Commander in Chief ; from all I could clean of intellience from the followers, it appeared there had been some hard fighting for five days ; but it ended, as might be anticipated, from the imposing force sent against the Sindeans. The moment the officer (who is one of the Staff, and an Irishman) landed, he set out for the Government House, to inform Lady Colville of the event, as it must be supposed she was in a state og anxiety, her husband being the commander, and her brother, and her uncle, Colonel T. Blair, being also on the expedition. At day-light this morning orders arrived from the Government House, to secure a passage and private cabin for the officer in th ship which takes this to England, but there was no such accomodation, as the cabins were all full ; and as another vessel will not sail from thence about ten days, this and will be off to-day, the chance is, you will have this letter at least six weeks before the officers can reach England with the official intelligence. All kinds of European produce are a drug hee, paricularly fine goods ; and rum, brandy, and geneva, are for a song. The cholera has rather abated, but still rages in a frightful manner. The Rio Janeiro packet arrived on Tuesday with letters to the 21st of November. Advices had been received from Rio Grande, stating that Artigas had been taken prisoner. The Portuguese frigate, Union, had captured two insurgent privateers which had been committing depredations on the coast. The events in Portugal, owing to which, as well as to the idea that the King would be prudent enough to sanction what had taken place in Portugal, the prices of produce had experienced very trifling alteration, though, if the contrary should be the case, a considerable rise was anticipated. The following relates to what is passing in Peru :– Extract of a letter from Rio Janeiro, dated November 20 :– The Chilians have at length carried into effect their boasted expedition, which left Valparaiso on the 21st August, and arrived at Pisco at the beginning of September. San Martin landed 4,500 men, but the blacks, cattle, &c. had all been previously sent away from the estates in that quarter, so that they will be disappointed in meeting with partisans ; indeed the slaves and lower orders, whom they expected to find favourable to their views, are the most irritated against the insurgents. We have letters from Lima to the 12th September, which speaks of the little apprehensions entertained of San Martin and his troops, the Viceroy having a formidable force, in the capital and vicinity, of 8,000 men, commanded by good officers. The Viceroy, is Commander-in-Chief, La Serna, second, and La Mar and O'Reilly command divisions. They were observin San Martin's movements who already experienced the difficulties of subsisting his men. The Marquis of Vallembrozo was on his flank, with a strong detachment of cavalry, with a view to prevent him from sending emissaries into the interior, and collecting horses. It is thought the insurgents will soon have to re-embark ; for, as soon as they are a little pressed for provisions, and fighting comes on, numbers will desert. Those who have already come over describe their situation as very critical. Two vessels, one an English, and the other a French, were preparing to sail from Callao for this place, and by them we shall receive further particulars. The most enthusiastic preparations were making in Lima to proclaim the constitution in a formal manner, for which purpose orders had been received from Madrid. This of itself is sufficient to defeat all views Cochrane and San Martin may have on the country, except, as before, a little plunder on the open and defenceless parts of the coast. Letters from Sierra Leone, dated the 24th of Nov. mention that the whole squadron was lying there.– The Pheasant, Myrmidon, Snapper, and Thistle, were lying off the Cape, waiting for the Morgiana to complete her water, provisions, &c. which ship was obliged to be assisted by the squadron, in consequence of her very sickly state. She had recently arrived from the River Gambia, whither she had proceeded in dread of attack by the natives on our infant colony there. A letter of thanks had been voted to Captain Finlason, by the merchants of that colony, for the very able manner in which he brought to an amicable conclusion the differences between the Native Chiefs and the British interests in the Gambia. The Morgania brought from the Gambia, Dr Dochard and forty-six men belonging to the mission under Major Gray, for exploring Africa. Dr D. had been at Sago ; but, in consequence of internal wars, he was unable to proceed further. Major Gray was there with very few men ; he will not proceed further for some time. undefined
        ID176Aberdeen JournalAberdeenScotlandUnited Kingdom18210314informColonial Intelligence Sierra Leone Gazettes to the 16th of December have been received. It is satisafactory to learn that some more effectual measures, than any before adopted by the French Government, to prevent slave trading are now in a course of execution. The French brig of war, Le Huron, of 22 guns, Commodore Du Pressit, is employed in cruizing for that purpose. Earthquake at Zante, Jan. 8.–The last week has been a scene of horror and destruction at Zante.– At four o'clock, on the morning of the 29th of Dec. we had a violent shock of an earthquake, which lasted nearly half a minute ; this was followed by eight other shocks, between four and six o'clock, which threw down one thousand three hundred houses. Providentially, the first shock did not throw down many, so that the inhabitants had time to escape before succeeding shocks, otherwise theloss would have been dreadful. Only ten lives have been lost, but not a house in the town has escaped without some injury. The town is still in a complete state of confusion ; one thousand give hundred houses more, being so much injured as to be marked in order to be pulled down ; all the steeples in the place must be taken down. The streets are almost impassable from the fallen houses ; and great caution is required, in walking, to avoid the ruins that are still falling. undefined
        ID180Aberdeen JournalAberdeenScotlandUnited Kingdom18210627informColonial Intelligence We have received Canada Papers to the 10th May. The active exertions of the Governor to improve the inland navigation had given very general satisfaction. In the course of the Session of the Colonial Parliament, which was prorogued on the 14th April, no less than three Addresses were presented to Earl Dalhousie, to be forwarded to the King ; one respecting the allowance of half-pay to the Militia ; another respecting the duties imposed in British ports on lumber from Canada ; and third related to the losses sustained by the people of Canada, during the late war. His excellency the Governor had intimated, that no objection would be made to the repeal of the grant of 2,500l on account of the Civil List for the Colony, provided the salaray of the Chief retired Justice, the ReceiverGeneral, and that of the Speaker of the House of Assembly, should be continued, in the whole amounting to 1,800l. The grant has for some time been a prominent subject of complaint in the Colonial Parliament. The 37th Regiment for three years stationed in Lower Canada is about to leave the Colony for England. The Staff Corps was to proceed to the Ottawa, to carry into effect the intended plan for removing the obstructions in that river. An article from Montreal, dated May 5, states, that a messenger was leaving that place to announce the union of the North and Hudson's Bay Companies, at their respective establishments. The former of these companies was under control of Lord Selkirk, and the schism that has so long reigned between them, with its fatal consequences, is well know to the Public. By Letters from Bombay we learn that 20 ships have been taken up by the vigilant Governor, on board of which 5000 troops are embarked, destined to the Persian Gulph, to repair the disaster suffered by the surprise of the detachment left by Sir Wm. Kier, under the direction of a young man. The gallant Gen. Lionel Smith has been selected for this important service ; and we have no doubt but that he will convince the Arabs of the impolicy of their treacherous proceedings, and justify the high confidence which the Go vernment of Bombay have in his talents and valour.– His Excellency Mr. Elphinstone, completely recovered, is gone on a tour to Kutch, to settle all disputes, and to ascertain the true situation of the country.– How important it is for the Heads of the Presidencies, thus to judge from actual observation, instead of trusting to mere reports. This proves the benefits of appointing men of experience and energy in the conduct of our Indian Empire–which is now, throuh the admirable conduct of the Governor General, and the two other Presidencies, in a state of unexampled, tranquility and prosperity. undefined
