Article ID 	Newspaper Title 	Newspaper City 	Newspaper Province 	Newspaper Country 	Year 	Month 	Day 	Article Type 	Text 	Keywords
        ID120Aberdeen JournalAberdeenScotlandUnited Kingdom18161216informCanada Lord Selkirk We have been favoured by a Gentleman in this city, with the following interesting and authentic communication, on the subject of the dispute between Lord Selkirk, and the Gentlemen of the North West Company: Extract of a Letter from Montreal, dated 6th October, 1816. In the newspapers which I sent you, you will see some accounts of the disturbances which have taken place in the North West between the North West Company and Lord Selkirk's colonists. The latter have been obliged to leave the Red River, after having had 22 of their men, including Governor Semple, killed by a party of half-breeds, the spurious offspring of the North West Company. As yet have not had an accurate statement of that melancholy transaction. Lord Selkirk's party state that these half-breed with some of the North West Com pany servants, came to destroy the settlement, and that Mr Semple, with about 25 of the Colonists, went out to meet them, to know what could be their intentions, when those rascals commenced firing on them, and massacred all but three, who were fortunate enough to make their escape. The North West people's account is that these half-breeds with some Indians were bringing down provisions from the upper part of the Red River to the entrance near Lake Winipie, and as the Colonists had the command of a great part of the river, they were obliged to pass in the rear of the settlement, which being observed by Governor Semple, who was on the look-out for them, he settled out of his Fort with 25 men and a [?]-piece to take from the Indians the provisions which were intended for the North West Company ; that the result[?] was an engagement which terminated in the defeat of the Colonists, of whom twenty-two were killed. Lord Selkirk [?] from Montreal for the Red River about the latter end of June, when[?] three or four officers and about 150 men of De Men[?]'s regiment, which had been disbanded, and when he arrived at Fort William on Lake Superior, hearing the fate of his Colonists, he[?] immediately issued a warrant against Mr M'Gillivray for high treason, conspiracy and murder, and subsequently warrants against all the partners of the N. W. Company, who were at F William, [?] formal possession of their establishment there, and sent Mr M'Gillivray, with about ten others, prisoners to Montreal, with all their papers [?] a number of packs of Beaver and other Furs, and several bales[?] of Merchandise, which he found in possession of the North West Company, belonging to the Hudson's Bay Company. The Police Officers in Montreal were several days examining the papers, and about four or five days after the arrival of Mr M'Gillivray and the others, they were admitted to bail, to appear to take their trial at the next criminal court, or any court of Oyer and Terminer which may be appointed. Stuart (the ci-de vant Solicitor-General, who was dismissed by Sir James Craig, and at whose instance an ineffectual attempt was lately made by some misguided members of our House of Assembly to impeach Chief Justices Sewell and Monk) is one of Lord Selkirk's counsel and spoke at great length, and what his friends and admirers call very eloquently, strongly opposed their being admitted to bail, but all would not do, and they were accordingly bailed ; Mr M'Gillivray in sureties of t1000 and the others in t500, sums inconsiderable enough, advering to the high crimes and misdemeanours with which they were charged. In the Montreal Herald you will see a very learned, and (as our neighbour Jonathan would say) a lengthy communication, signed Montius[?], setting forth the rights which the Hudson's Bay Company by their charter possess over the Countries which they have granted to Lord Selkirk, and the power vested in him of appointing Governors and other Officers to superintend and regulate the Colony. Being a masterly production, it will no doubt makes its appearance in a pamphlet, and when it does, I shall send you one, in case the papers should miscarry. It is uncertain whether the Earl will remain in the North West during the winter, or come down to Montreal ; if the latter, he must be down[?] soon[?], as the season for water-travelling will shortly close. Montreal is now divided into two parties, one favouring the Lord, and the other the North West Company ; and with the exception of the friends of the latter, strongly in favour of his Lordship. Native Americans;military;rebellion
        ID126Aberdeen JournalAberdeenScotlandUnited Kingdom18180128informCanada Extract of a letter from a Mercantile House in Nova Scotia, to their Correspondents in this quarter. We sincerely hope that the Duties Government had in contemplation (last year) to impose upon Timber imported into Great Britain and Ireland, from the British North American Provinces, equal to the additional duty imposed on Foreign Timber in 1813 will be further suspended. Our[?] commercial system chiefly depends upon the encouragement of the Timber branch ; ships that carry away that article[?] bring us [?] at a low freight, whereby we are enabled to furnish the British West India Islands with an abundant supply of Fish[?], and that on very moderate terms ; but, in the event of Government persisting in imposing the Duty on Timber from hence, that branch of our trade will inevitably revert to the Americans, besides being the ruin of many in this and in the neighbouring Provinces. The supposed revenue that would accrue to the mother country, upon trial, will be found delusive ; to prove this, many obvious[?] reasons can be adduced : As the trade now exists, all the Timber extracted from these Colonies to Great Britain and Ireland is paid for in British Manufactures ; the export of so bulky an article as Timber, and the import of so ponderous an article as [?], employs[?] an immense number of British ships ; objects certainly of more real value to the revenue of Britain than any benefit they could possibly derive from direct Duties imposed on the export of Timber from British North America. It cannot be denied that previous to 1813, when the additional Duty was laid on Foreign Timber, they (the Foreigners) were not only the carriers, but would not accept an ounce of British Manufacture in payment for their TImber–no, nothing but you gold[?] which was so much in demand, that 28s. was given for a [?]. Another very cogent reason [?] be advanced in favour of what is commonly denominated the Timber Trade from these Provinces ; it facilitates emigration, and introduces many valuable settlers into this Province, and the Canadas, that would go to the States of America ; and the day is perhaps not so far distant when they would of accessity[?] become our enemies. When Great Britain was first involved in war with the eastern countries, from whence the principal supply of Timber was derived, the merchants in that line[?], as well as the ship-masters were not only alarmed, but convinced themselves ruined ! The Baltic is shut[?], what shall we do for Timber, and with our ships? They properly concluded that perhaps the British Provinces could supply them ; they made the experiment, they were not disappointed–but succeeded far beyond their expectations. If therefore, in time of war, Britain has took to her colonies for a supply of such a necessary article as Wood ; it is not reasonable for us to conclude that their interests will not be wholly neglected, when blessed with peace. Extract of a Letter, dated Savannah, 25th Nov. 1817 In the Southern States, this autumn has been the most fatal they have experienced since their colonization. Many thousands have been hurried off to that narrow house destined for all that live. A most malignant fever has prevailed to an alarming extent. In this city, during the last four months, the deaths have been equal to one-eights of the inhabitants left in it ; and in Beaufort (S. Carolina) and in some of the Southern Counties, the morality has exceeded one-sixth! timber trade;international trade;manufacturing;emigration and immigration;United States--Relations--Great Britain;Great Britain--Relations--United States;weather;disease
        ID133Aberdeen JournalAberdeenScotlandUnited Kingdom18191013informColonial Intelligence Death of The Duke of Richmond. By the Henry, arrived in the rive from Quebec, we have advices from thence of the 4th September, three days later than the last accounts. They confirm, we regret to say, the intelligence received at Lloyd's on Friday, of the death of the Duke of Richmond, at Montreal, where he had arrived on his return from inspecting the new settlements in Upper Canada. His body had been brought from Montreal to Quebec, where it was lying in state at the time the Henry sail ed. His daughter Lady Mary Lennox, continued in the most afflicting state, and great fears were entertained for her recovery. Lady Sarah Lennoc, his Grace's second daughter, is married to Major-General Sir Peregrine Maitland. They accompanied his grace to North America, and have remained there since he entered upon his Government. His Grace was the lineal descendant of the first Duke of Richmond, natural son of King Charles II. by a French Lady, who was created by his Majesty Duchess of Portsmouth, and by Louis the Fourteenth, Duchess of Aubigny, in France. His titles were, Duke of Richmond, Early of March (English honours) ; Duke of Aubigny, (French Honour) ; Duke of Lennox, Early of Darnley, and Baron Methuen of Torbulton (Scots Honours). The title of Aubigny was confirmed in March 1816, by Louis XVIII by causing the estate of Aubigny to be assigned to him, and granting him the honours of the Louvre, as enjoyed by his Grace's ancestors. He was a Lieutenant-General in the army, Colonel of the 35th regiment of foot, Gonervor of Plymouth, Governor of Upper and Lower Canada and their dependencies, Lord Lieutenant of the county of Sussex, and High Steward of Chichester. –His Grace was born in 1764, succeeded his uncle, Charles, the late Duke, in 1806, and married in 1783 Charlotte, daughter of Duke of Gordon, by whom he had issue seven sons and seven daughters, all of them now living, except his third son, Henry Adam, R. N. who fell overboard the Blake, as she was sailing into Port Mahon, in 1812, and was drowned. His Grace was distinguished early in life by a duel with His Royal Highness the Duke of York. He was of an open, candid, generous temper, and of plain and unaffected manners, qualities which were particularly conspicuous in Ireland, when Viceroy of that country. His Grace is succeeded in the Peerage his eldest son Charles, Earl of March, now Duke of Richmond. This young Nobleman in the army, has seen much active service under the personal auspices of the illustrious Wellington, being one of his Grace's Aides-de-camp, and was one of the Representatives in Parliament for the City of Chichester, which seat, of course, becomes vacant. He was lately married to the eldest daughter of the Marquis of Anglesea, and has issue, a Son, now Earl of March. The following is extracted from the Quebec papers: Quebec, Thursday, Sept. 2. This Province has again been visited by one of those afflicting dispensations of Providence, which by separating by the hand of death, the ruler from the people, covers whole communities with mourning. An express arrived here yesterday morning from Montreal, with the afflicting intelligence chief that his Grace the Duke of Richmond, Governor in Chief of these Provinces, had died on his way from Kingston to Montreal, at the moment that he was hourly expected to join his family there, from which he had separated in good health at Kingston, one the 20th, to complete by visiting the new Settlements, the long and arduous journey in which he has been engaged. This melancholy and utterly unexpected intelligence, spread with the greatest rapidity, and impressed a deep gloom throughout the city. The flag on the citadel, and on all the vessels in the port, was hoisted half-mast, exhibiting every where the signals of public mourning. His Grace's body, immediately after his death, was conveyed to Montreal. It reached this city last evening in the steam-boat Malsham, and was removed this forenoon to the Castle, with the usual military honours, and followed by his Grace's Staff, the principal Civil and Military Officers in the City and Garrison, and a great concourse of mourning inhabitants. September 5. His Grace's remains were conveyed from Montreal to Quebec, in a steam-boat. At ten o'clock, one the morning of the 2d of Sept. they were removed from the vessel, and placed upon a hearse upon the King's Wharf at Quebec, from whence it was conveyed to the Chateau of St. Louis, where they lay in state until four o'clock on Saturday the 4th September, when they were removed to the place of internment in the Cathedral Church at Quebec. On the corpse being brought out, the collar and insignia of the Order of the Garter, with his Grace's military and other appointments being placed on the coffin, the whole of the troops presented arms. On its being placed on the hearse, the troops rested on their arms reversed. The procession then moved forward. It was composed of all the principals persons attached to the public, military and civil departments. The military band filed off at the door of the Cathedral Church-yard and conducted it up the centre aisle, when it was played on a platform, the mourners remaining by the body. A signal was then given, when the body was deposited – 15 guns being fired. Extract of a letter, dated Quebec, Sept 5 :– When I wrote the first side, I did not expect so soon to communicate the melancholy event of the death of our Governor, the Duke of Richmond, who was attacked on his route from Upper Canada, with symptoms of hydrophobia, which terminated his mortal career at six miles from the settlement of Richmond. He was perfectly sensible of his situation, and gave himself up from the first spasm which attacked : it was occasioned by a bite of a tame fox at Sorel, on his way to Upper Canada, about three months since. His death, at this juncture, is looked on as very unfortuante for this country, as he possessed the entire confidence of Government, and was about completing a plan of defence for the Canadas, which, when executed, would establish a water communication with our extreme points, perfectly free from interruption, in case of a war with the States. We are happy to learn, further, that no part of his Grace's family was so dangerously ill, as was at first reported. They are only in that situation which might be expected, from so severe an affliction. Colonel Wilson had succeeded the late Duke of Richmond as Governor-General of both Canadas, being the senior Officer on that station. Sir Charles Saxton, and Major M'Leod, Aides-deCamp to his Grace the Duke of Richmond, have gone to Lake Winnipeg, clothed with special powers, to investigate the causes of the unhappy dissentions which are said to have been lately renewed in that quarter between the North West and Hudson's Bay Company. By the new act, regulating the commercial intercourse between the province of Upper Canada and the United States, the duties on the importation of manufactures and provisions from the States are considerably reduced on [?] of the enumerated articles, although on nails, snuff, manufactured tobacco, and spirits, they are riased. The ad-valorem[?] duty is reduced from 10 to 5 per cent. Buffalo, Aug. 4. On Friday, came[?] on before the Court of King's Beach, at Niagara, the trial of Robert Gourlay, Esq. for a misdemeanour, in not obeying the orders of the Magistrates at Niagara, in December last. Mr Gourlay was found guilty, and banished the province. From the Quebec Gazette of 26th August: This morning, about 9 o'clock, Lieut. Birch, of the royal navy, put a period to his existence by shooting himself through the head. We are informed that Mr Birch had for sometime previous to his death laboured under a melancholy state of mind. An amiable[?] wife and one child are the survivors[?] of this awful [?] The Annual Report of the Agricultural Society of Quebec has been published from which it is evident that a laudable spirit of enterprise has been awakened in that important country. The Committee, who, in the execution of their functions travelled through the greater part of Lower Canada, conclude their Report by putting on record a testimony they justly conceive to be honourable to the character of the inhabitants of the country through which they passed. Although many hundreds of persons from all parts of their respective Counties attended the Agricultural Meetings, which were frequently of four or five hours duration, there did not occur at any of them a single instance of intoxication, disorderly conduct or personal altercation. The Grand Jury at Nassau, New Providence, have brought in a bill against Sir Gregor M'Gregor, charging him with aiding and abetting piracy, by issuing commissions in the Bahamas, to subjects of Power in unity[?] with Spain. A letter from Sierra Leone, dated the 9th of March says– It is with the deepest regret I inform you that, notwithstanding the liberality of Great Britain, and the faith of Treaties, the coasts swarms with slave vessels, dragging thousnads of its miserable inhabitants into endless captivity. A few days ago arrived here the Union, of Liverpool : the Supercargo states, that during his stay in the river Calabia, not less than eight vessels, averaging 500 slaves each, had sailed for the Spanish Colonies. We have received Gibraltar Chronicles to the 10th ult. from which we learn that, in consequence of the rapid increase of the fever at the Isle de Leon, his Excellency Governor Don had issued a Proclamation on the 2d ult. announcing that all communications with Spain (except through the customary process of quatine) would close at sun-set on the following evening. Notice was also given to such of the labouring classes as had not passed the fever, that they would be provided with tents and encamped on the neutral ground for their better security against infection should it unhappily appears in the fortress. They would not be suffered to proceed to town, and follow their callings, during the day, but heir return to the encampment at night was peremptorily enjoined. We are happy to learn, however, by the latest advices from the British fortress, that the garrison and inhabitants were not at all infected with the disease. undefined
