Article ID 	Newspaper Title 	Newspaper City 	Newspaper Province 	Newspaper Country 	Year 	Month 	Day 	Article Type 	Text 	Keywords
        ID135Aberdeen JournalAberdeenScotlandUnited Kingdom18190120informColonial Intelligence York, (U.C.) Nov, 4. Lord Selkirk vs. North West Company. On Friday, the 30th of October, the Court of Oyer and Terminer proceeded to try the gentlemen accused as necessaries to the murder of Robert Semple, Esq. and others at Red River, on the 19th of June, 1816 and the trial was rendered extremely interesting by the disclousure which took place of many extraordinary circumstances connected with the Hudson's Bya and North West Companies, which for some time past has excited so much of the public attention in this Province. The gentlemen tried on this occasion were, Messrs. Alexander Mackenzie, Hugh M'Gillis, Simon Fraser, John Macdonald, and John M'Laughlin } accused as accessories after the fact. and Mr John Severlight, accused as an accessory before and after the fact. It appeared in evidence that the North West Company had been upwards of thirty years in possession of trading posts called forts at different points on the Red River in the Indian Territories, and it is well known that for a century before the North West Company, the Canadian for traders had been in the constant practise of resorting to that country which was visited for the first time by traders of the Hudson's Bay Company about twenty-five years ago. It was put in evidence that for many years afterwards both companies carried on their trade to Red River without interference in each others pursuits, and without any disturbance in the country ; and it was explained that the principal object of the trade being to collect provisions, (enlisting chiefly of the dried flesh of the buffalo, which abound in the plains) and the country producing abundance for the supply of both parties, the same causes of dissention did not exist as at trading stations where the fine furs are obtained in small quantities, and where rival traders would at all times be likely to dispute about the divisions of them. The Red River country therefore remained quiet and undisturbed until the arrival of the Earl of Selkirk's Colonists and Servants, and the attempts made by their leaders to prevent the usual supplies of provisions from being obtained by the traders. The proclamation of Miles Macdonnell the soi-disant Governor of Ossinibour, prohibiting the exportation of provisions from Red River, was the first document produced for the defence at the recent trials. It was proved that, under this assumed authority, several acts of violence were committed by Mr Macdonnell and his followers. Trading posts and buildings were forcibly entered, depots of provisions seized, the river (the only outlet from the country) blockaded by batteries mounted with cannon, and the trade of the North West Company wholly interdicted, before any acts of retaliation were attempted on their part, and even before they took any precautions for their own defence or for ensuring the safety of their provisions, on which depended the existence of their trade, and the lives of their people. Mutual and continual acts of aggression and retaliation appeared to have exasperated the minds of both parties, and to have rendered them so suspicious of the designs of each other as to be always on their guard and prepared for defence. In short it appeared in evidence that the country remained in a state of private war, which at length ended in the battle of the loch of Jane, 1816. The particulars of this unfortunate affray were fully investigated in the trial of Bouche and Brown for murder, as principals. The statements on both sides are already before the public, and the acquittal of the prisoners shows sufficiently that the jury considered Mr Semple and his party to have been the assailants. On the trial of the alleged accessories the cirumstances which led to the meeting of the hostile parties were made out in the evidence to the following effect, viz : – In March, 1816, Mr Colin Robertson, with an armed party, acting under the orders of Governor Semple, who had succeeded Governor Miles Macdonnell at Red River, captured by surprise the North West trading post at the forks of the river, called Fort Gibraltar, and took possession of all the stores and provisions. In the latter part of the following month of May, Governor Semple caused the buildings (which were of wood) to be taken to pieces, and the materials were floated fown the river in rafts, to be used in constructing his new fort, which he called Fort Douglas and where, (following the examples of his predecessors) he mounted cannon to command the passage of the river, built an armed schooner, or gun-boat, to com plete the blockage, and effectually to intercept the provisions and trade of the North West Company. Mr. Alexander Macdonnell, a partner of the North West Company, who had charge of their provisions at Riviere Qui Appele, one of the branches of the Red River, became alarmed at these measures of hostility, and assembled as many people as he could (half breeds and others) for the protection of the property under his care, with which, at the usual time, he proceeded down the river till he arrived within sixty miles of Governor Semple's fort. He then landed his provisions, made dispositions to defend them, if attacked, and sent a party of his people, with a temporary supply to meet the canoes from below, apprise them of the blockages, and concert with them the means of eluding or removing it. This party, under the direction of Cuthbert Grant (a half breed, and a clerk of the N. West Company) was ordered to land above Fort Douglas in order to keep out of the reach of the cannon, and to carry these provisions in carts, at as great a distance as possible from the fort, so as to avoid being seen.– This it was fully proved they did ; but a swamp in the rear of the fort compelled them to pass within about two miles of it, and being deserted and pursued from then, the conflict ensued in which Mr Semple, and most of his party, were killed. It was further made out in evidence that in the Spring of the year 1816, the agent of the North West Company at Montreal were still in need of more than the usual supply of provisions from the Red River, because there had not yet been time to replace the vessels on the lakes, and the other means of transport which the Americans had destroyed during the war, nor to replenish their stores at Fort William, with the usual quantity of provisions from Canada. Having also heard of the seizure of one of their posts at Red River in the fall of the year 1815, and apprehending further aggressions in the spring, Mr M'Leod, one of the agents, with all the partners and clerks who could be spared from Montreal, proceeded up the country early in the Spring, and on arriving at Fort William, received intelligence of the capture of Fort Gibraltar and the blockade of Red River, towards which place he immediately proceeded with as many of the partners, clerks, and servants of the Company as he could collect by the way, in order to rescue the intercepted provisions, in the defence of which, or in their own defence, if fired on by Semple's blockading battery, it was their avowed purpose to use force if necessary, but it was distinctly proved that their intentions and orders issued to their cannonmen, were, to pass Fort Douglas singing, and to proceed up the river for their provisions, without landing or molesting any one unless they should be attacked.–They arrived at Red River three days after the battle, and Mr M'Leod, who was a Magistrate, being of opinion that Mr Semple's party had been the assailants, and that the half breeds had only acted in self defence, did not adopt any measures against them, (the half breeds) but, on the contrary, expressed approbation for their having defended their provisions, and gave them the supplies of clothing, &c. usually given to all the servants of the North West Company, while, at the same time, he arrest some of the survivors of Mr Semple's party, and served subpoenas upon others to give evidence of these transactions in the Courts of Lower Canada. This was the whole of the evidence, and the only circumstances which appeared relative to the prisoners, were that Mr Sevewright (the alleged accessory before the fact) was with Mr Alexander Macdonnell when he sent off Grant and his party to escort the provisions past Fort Douglas, and that the alleged accessaries after the fact arrived at Red River with Mr M'Leod, after the battle was over, and appeared to consider it, as it is now found to have been, an affray in which the unsuccessful party were to blame, and in which the successful party were not murderers –The Judge who presided at the trial, declared in his charge to the jury that there was not a scintilla of evidence against any one of these gentlemen, and the jury accordinagly returned a verdict of Not Guilty. It will be recollected that these gentlemen were arrested by the Earl of Selkirk, at Fort William, in Aug 1815, on the charges of High Treason and Conspiracy, as well as Murder–and that the buildings and property of the North West Company at that place were forcibly seized and subsequently retained by an armed force under his Lordship's command. The North West Company represented at the time that these accusations were merely a pretext set up to palliate the preconcerted plunder of their property, and destruction of their trade, while, on the part of Lord Selkirk, it was alleged that the crimes committed by the partners of the North West Company were so atrocious, as to justify his Lordship's proceedings against them ; and for some time the public opinion remained in suspense as to the real merits of the case. So far as regarded the seizure of property and the interruption of trade, the point was decided by the Prince Regent's Proclamation of the 3rd of May, 1817, in consequence of which the North West Company recovered possession of their property, and re-established their trade ; but that proclamation left the rights of parties, and the crimes alleged against the individuals, to be investigated and decided upon by the law – and until such investigation could take place, much uncertainty necessarily prevailed from the contradictory statements and affidavits which had been laid before the public. The recent trials at York however decided the point as to the alleged murders, and the charge of High Treason has never been followed up, nor ever mentioned, since it served the desired purpose, by figuring in Lord Selkirk's Warrant as a pretext for seizing and examining the books and private papers of of the North West Company. undefined
        ID138Aberdeen JournalAberdeenScotlandUnited Kingdom18190428informColonial Intelligence. Halifax, March 13. A very numerous and respectable meeting of the inhabitants of this town was held at the Exchange Coffeehouse, on Saturday last, George Grassie. Esq. to the Chair. It was resolved unaminously–That the Legislature be petitioned to authorise the establishment of a bank in Halifax.–That 50,000l be the capital, to be invested in the British funds.–That notes to the amount of 150,000l be issued by the Bank.–That the shares be 100l each, and every five shares, according to a classification, entitled to a vote.–That the Bank be authorised to pay notes presented, either in specie, provincial paper, or bills of exchange on London at the current rate – A Committee was then appointed to prepare the Petition, and cause it to be presetned to the Legislature. The gentlemen present immediately afterwards unanimously agreed to give to the doubloun the value of 4l and to the sovereigh the value 1l, 2s. 6d. currency. The meeting then adjourned. York, Upper Canada, Feb. 6. Tex v. The Earl of Selkirk and others A bill of indictment, for a conspiracy to ruin the trade of the North West Company, and impoverish the partnes thereof, was found by the Grand Jury, against Thomas Douglas, Early of Selkirk ; J. B. Chevalier de Lorimer, Captain in his Majesty's Indian Department ; Captain Pratais D'Orsonnens, late of the De Meuron Regiment ; Captain Frederick Matthey, ditto ; Lieutenant G. A. Fauche, ditto ; Lieutenant Frederick Graffenrad, ditto ; Serjeant Jacob Vichie, ditto ; Captain Miles Macdonnel, late of the Canadian Fecibles ; Lieutenant Alexander Bridport Beecher, late of the Royal Navy ; Doctor John Allen, John Spencer, Donald Macpherson, James Chatelain, John M'Nab, Archibald Macdonald, and John P. Bourke. The indictment contains three counts ; and amongst the numerous overt acts therein set forth, supported by documentary and oral evidence, the following were particularly prominent :– The engaging and armind a number of disbanded soldiers (foreigners) ; the entry of them, by force of arms, into Fort William, in August, 1816 ; retaining possession of the fort till May 1817 ; sending off as prisoners the partners of the North West Company found there ; getting rid of the clerks, by subpoenas to appear at York at a period when no courts are held there, without ever inquiring whether they know anything of the matters to which the subpoenas related, and without ever bringing them forward afterwards ; stopping of the outfits from going into the interior, and the returns from coming into Montreal ; possessing themselves of all the books and papers of the concern ; sending away the principal clerk under a charge of felony, without examination, and without having ever followed up the charge ; the pretended sale, by Daniel Mackenzie, of the North West property, obtained by his Lordship by means of continued duress ; tampering with, and debauching the North West Company's servants, and commanding them in the King's name ; writing circular letters to the partners and clerks in the interior country, advising them to abandon their trust, alleging that the North West Company were ruined, and to carry the furs to Hudson's Bay ; taking possession of Fort Lake La Pluie, and the property there, and stopping the navigation, &c, &c. Upon this being returned a true bill the AttorneyGeneral moved the process of the Court against the parties ; and Dr Allen being present, was to be arraigned the following day. Wm Smith v. The Earl of Selkirk This was a civil action brough by Mr Wm Smith against Lord Selkirk for false imprisonment. It appeared in evidence that the plaintiff was undersheriff of the Western District, and as such, the bearer of a writ of restitution founded upon a verdict of a special jury at Sandwich, in October 1816, and granted by the Magistrate, ordering the restoration of Fort William to the North West Company. He was also the bearer of a warrant, for felony, issued against his Lordship, Dr Allen, Captain Matthey, and others, upon an information upon oath before a justice of the Peace. Mr Smith got to Fort William on the 19th of March 1817, and produced his writ of restitution, with which his Lordship refused to comply ; and when the Earl and others were arrested by Mr Smith, upon the warrant for felony, his Lordship laid hold of him and pushed him out of doors ; and he was afterwards kept in close custody in the fort under a military guard. A circumstance which added much to the grievous nature of the offence, and which was particularly dwelt upon by the Judge, in his charge to the Jury, was, that whilst Mr Smith was kept in a rigorous confinement, Charles de Reinhard, though under an accusation of was at large and keeping a school, though nominally under the surveillance of one or two of his former comrades. The Chief Justice also remarked upon another part of the evidence for the defence, by which it appeared that the only option left to Mr Smith to obtain his liberty was that of abandoning his duty, and breaking his oath of office, by a promise not to molest Lord Selkirk. Mr Smith, however, notwithstanding this proposal, persisted in doing his duty, and was not liberated until the evacuation of Fort William by his Lordship and his forces in May, 1818. The Jury after some deliberation, returned a verdict in favour of the plaintiff.– Damages L.500 Halifax currency. After narrating the military parages, &c. at Richmond, in America, in honour of the 22d of February, a journal says, A melancholy catastrophe closed the day. Colonel W. Tatham, so well known in England and this country, for his acquaintance with civil engineering.–who has been residing in this city for two or three years, but whose utility was considerably arrested by an unfortunate habit to which he had become addicted–was destined on that day to breathe his last.– In a moment of intemperance, as he stood by the piece of artillery which was firing the evening salute, he exclaimed that he wished to die. As the second gun was about to fire, and immediately after the commanding had given the word Fire! Conolonel Tatham presented himself in front of the muzzle of the piece, and by its discharge his abdomen was almost literally blown to pieces. His body was raised a few feet in the air by the explosion, and he fell upon his face without uttering one word that was heard by the byestanders.– Colonel Tatham died without any family. Circumstances had strip life of much of its attractions in his eyes ; but it is impossible not to regard the manner of his death with horroer, and to feel the deepest commiseraton for his melancholy fate. He was a man of great information, of great genius, and of great resource of mine. But to this melancholy end he has arrived. meeting;obituary;banking
        ID140Aberdeen JournalAberdeenScotlandUnited Kingdom18190526informColonial Intelligence Some Canada papers to the 11th let. have arrived in town. Sir Peregrine Maitland had summoned the Parliament of Upper Canada to meet him at York, on the 22d of April. He had appointed Port Talbot in the town of Dunwich, a port of entry, in the same manner as those established between Canada and the United Statess. Extract of a letter to a Gentleman in George-town, dated Tobago, Feb. 9. 1819.–' The heavy rains which continued during the months of December and January, almost inundated the country, which brought on a most rapid and fatal disease, which made its first appearance in the frost, at a short distance from the town, consisting of 212 men strong, and in 10 or 12 days, 45 of that number were numbered with the dead. The contagion was so rapid, that it soon spread into the town, shipping, and country, and proved equally fatal. The disorder was such, it baffled all medical aid. The alarming symptoms were such, that business was nearly suspended–the white population seeking safety in other islands, or in the remote and healthiest part of this. I assure you, that every thing had a most gloomy appearance ; and the disease was so contagious, one man would hardly venture to touch another. The William's crew, from their mutinous disposition, deserted her–some have since died ; and some remain sick. The weather has become good within these fifteen days, and the health of the island improving fast.' A series of Sierra Leone Gazettes, to the 20th of February, have reached us. They contain no intelligence of particular interest, expect that the colony appears to have been healthy at that period. In one of them we find a contradiction of the reports which found their way into the English papers some months since of the dreadful mortality that prevailed in that settlement. It states that the total number of Europeans who died in the Peninsula in 1818, was eight men, three women, and two children. We lost no civil, military or colonial officer, excepting one young Gentleman who died a month after his arrival, and is included in the number. A letter from the Havannah, dated 27th February, mentions that the article of coffee is gradually rising in value, and that an agent from Messrs Baring is making purchases there to the amount of 1/3 a million sterling, in that single commodity. colonial politics;weather;disease;disease
        ID144Aberdeen JournalAberdeenScotlandUnited Kingdom18190602informColonial Intelligence Advices have been received again from the Cape of Good Hope of 6th March, which are several days later than those acquired formerly. Of the rising of the Caffres there remains no doubt, although it does not appear that Government have as yet received official information regarding it. The private accounts state that two valuable officers had lost their lives, and also a great number of men. The Governor himself in order by his presence the sooner to suppress the Caffres, had, with a competent force, proceeded to the interior. Great inconvenience was experienced for the want of cavalry in so extensive a country ; had not this been the case, it was believed that in a very few days tranquility would have been restored. We are sorry to state that another hurricane has taken place in the Isle of France ; it commenced on the 25th January, and has done great mischief to the shipping, and also to the plantations of that ill-fated Island. A Dutch mail has arrived, with papers to the 19th inst. At Batavia, two of the leaders of the late disturbances have been tried and execute, and that degree of tranquility which terror produces has been restored. In the administration of their colonies in the east, the conduct of the Dutch has always been cruel and oppressive ; and it is to be regretted that the extensive and fertile island of Java should have been surrendered to their rapacity. During the short time that it was in possession of this country, various important improvements were introduced into its domestic administration ; the practise of torture, according to the humane and enlightened maxims of British jurisprudence, was abolished ; new and better modes of collecting the revenue were adopted ; and a spirit of mildness and of regard for the interests of all the various classes of which the population is composed, was evinced, which made the British Government highly popular. Considerable anxiety prevails among the merchants for the safety of the Queen Charlotte, Jamaica packet. She sailed from Jamaica the 29th March, and had a great quantity of specie on board. No things have since been received of her. Several vessels sailed since her departure, and have arrived safe. The Ocean quitted Jamaica on the 6th of April, and arrived here several days since. Several passengers landed at Portsmouth on Thursday from Jamaica, bring Port Royal Papers to the 25th of March. The 50th Regiment had arrived at Kingston, from Cork ; and the 2nd West India Regiment was about to embark for Sierra Leone to be disbanded. colonial government;law;military;postal service;rebellion;shipping;timber trade;weather
