Article ID 	Newspaper Title 	Newspaper City 	Newspaper Province 	Newspaper Country 	Year 	Month 	Day 	Article Type 	TextID134 	Caledonian Mercury 	Edinburgh 	Scotland 	United Kingdom 	1819 	01 	02 	persuade 	In answer to the remarks which appeared in our paper on Monday last, respecting emigration to America, and to the statements there given of the disadvantages which emigrants from this country might expect to meet with, we have received a very abusive letter from an anonymous correspondent, who appears very angry, and, like most other angry men, seems more anxious to give full vent to his wrath than to assign any good reason for it. His first cause of quarrel is, that we have stated the general want of cleanliness to be a prevailing defect in the back parts of the United States. For this we have the authority of almost every traveller who has visited those parts. The remarks of Birkbeck on this point are conclu-sive and striking: – ' In viewing the Americans (he observes) and ' sketching, in a rude manner, as I pass along, ' their striking characteristics, I have seen a de' formity so general, that I cannot help esteem' ing it national, though I know it admits of ve' ry many individual exceptions. I have written ' it, and then erased it, wishing to pass it by, ' but it wont do – it is the truth, and to the truth ' I must adhere. Cleanliness in houses, and too ' often in person, is neglected to a degree which ' is very revolting to an Englishman. ' America was bred in a cabin ; this is not a ' reproach – for the origin is most honourable ; ' but as she has exhanged her hovel of unhewn ' logs for a framed building, and that again for ' a mansion of brick, some of her cabin habits ' have been unconsciously retained. Many have ' already been quitted, and one by one they will ' all be cleared away, as I am told they are now ' in the cities of the eastern states. ' There are, I believe, court-houses, which ' are also made us of as places of worship, in ' which filth of all kinds has been accumulating ' ever since they were built. What reverence ' can be felt for the majesty of religion, or of ' the laws, in such styles of abomination ? The ' people who are content to assemble in them ' can scarcely respect each other. Here is a bad ' public example. It is said that to clean those ' places is the office of no one. But why is no ' person appointed ? Might it not be inferred ' that a disregard to the decencies of life prevails ' through such a community?' To the same purpose Cobbett complains of the ' general (for there are many exceptions) sloven' liness about the homsteads, and particularly ' about the dwellings of labourers. Mr Birkbeck ' complains of this, and indeed what a contrast ' with the homesteads and cottages which he left ' behind him, near the exemplary spot, Guild' ford, in Surrey.' He then proceeds to give the reasons for this. When the first settlers took possession of the country, the ' example of neat' ness (he observes) was wanting. There were ' no gentlemn's gardens, kept as clean as ' drawing-rooms, with grass as even as a car' pet. From endeavouring to imitate perfec' tion men arrive at mediocrity ; and those who ' never have seen or heard of perfection in these ' matters, will naturally be slovens.' He afterwards remarks – ' The market day at Guildford is a perfect ' show of cleanliness. Not even a carter without ' even a clean smock-frock, and closely shaven ' and clean washed face. Well may Mr Birkbeck, ' who came from this very spot, think the people ' dirty in the western country. I'll engage he ' finds more dirt upon the necks and faces of one ' family of his present neighbours, than he left ' behind upon the skins of all the people in ' the three parishes of Guildford. However, he ' would not have found this to be the case in ' Pennsylvania, and especially in those parts where ' the Quakers abound ; and, I am told, that in ' the New England States, the people are as ' cleanly and as neat as they are in England. ' The sweetest flowers, when they become pu' trid, stink the most, and a nasty woman is the ' nastiest thing in nature.' In answer to all this, our correspondent tells us, that the Scotch are very dirty. This, we admit, was formerly, and may still continue in some degree to be, the reproach of the Scotch. But does this reasonable person mean to argue from this, that dirty habits are amiable, and ought not to be corrected. With regard to the difficulties of effecting a settlement, we are borne out in our remarks on this subject by the authority of various writers, and principally by the autheor of the Emigrant's Guide, a work of great merit, which combines an extent and precision of statistical information altogether unequally, with the most enlarged general views of the state of the country, both physical and moral. ' Most men (observes ' this judicious writer) on arriving in the United ' States, expects too much. Perhaps the only ' essential advantages offered are the security of ' person and property, and the cheapness of land. ' It demands excessive labour, severe economy, ' and exepmtions from extraordinary accident, to ' succeed in a newly settled country ; and it de' mands the permanency of this continued la' bour, prudence, and favourable circumstances.' Our anonymous correspondent is also extremely displeased that we have stated so strongly the perincious effects produced on the general manners of the Americans by the existence of slavery ; and he mentions that many a labourer in this country might envy the condition of an American slave. What are those privileges for which a free man should envy a slave he does not think proper to state. To show, however, that we have not exaggerated the degradation and oppression of the coloured class in the United States, we shall again adduce the authority of the Emigrant's Guide. The author is contradicting the notion that the labourer in the slave States is confounded with the negroe ; and he expresses himself in the following terms: – ' A residence of 16 years in places where sla' very is prevalent, enables us to contradict a ' general expression, that, in such places, whites, ' performing manual labour, are confounded in ' the moral estimates of the people with slaves. ' Though less respect is certainly paid to useful ' labour in the slave states than where all the ' duties are performed by whites, yet ' the distance between the two races of men are ' in all cases immense. So deep, profound, and ' inveterate is the feeling on that subject, that ' not any where in the United States can pro' perty, sobriety, intelligence, and every other ' advantage, expect colour, raise in public opi' nion a man the most remotely allied to the ' African, to a rank equal to the meanest white. ' Any person who resides a few years in Louisi' ana will be witness to some very remarkable ' exemplifications of this innate contempt for all ' those who affinity involve them in the con' tumely heaped upon men degraded by slavery.' What a picture is here conveyed of misery and degradation on the one hand, and of tyranny on the other. – Here we find it failry confessed that no degree of worth, whether moral or intel lectual, not even the possession of property, can give a man the least degree of consideration in the eyes of the privileged class. We cannot conceive a community more wretchedly constituted. All that is estimable and worthy is here utterly contemned, because the individual who possesses these qualities happens to have his skin of a particular colour, and thus a merely accidental quality of the corporeal frame entails upon its unhappy possessor everlasting ignominy and contempt. These distinctions, carried to such an excess, seem to us to be founded on the extinction of every generous and honourable sentiment, and we cannot help still asserting that we had rather live we at present are, than in a community where such hateful antipathies rule to the exclusion of every just and humane feeling. With regard to the condition of the negroe slaves we shall quote a passage from Brown's Western Gazetteer or Emigrant's Directory after reading which, we shall leave our anonymous correspondent to say whether he thinks the condition of a labourer in this country preferable to that of being an African slave. The writer, describing the town of Lexington, in Kentucky, observes – ' In this square stands the market-house, ' which is of brick, and well furnished on Wed' nesdays and Saturdays ; but occasionally the ' scene of a barbarous practise ; for it is here ' that incorrigible or delinquent negroes are ' flogged unmercifully. I saw this punishment ' inflicted on two of these wretches. Their ' screams soon collected a numerous crowd ; I ' could not help saying to myself, These cries ' are the knell of Kentucky libery.' Having made this answer to the angry charges thus brought against us, we have only to disclaim, in the strongest terms, all hostility or prejudice against the Americans. We have no wish either to depreciate their character or institutions. They exhibit the interesting spectacle of a nation advancing with an irresistible pace to wealth and greatness. To revile such a people would be the height of human folly, and equally foolish is it for their blind admirers to take offence because endeavour to make a fair estimate of their character, without hiding any of its defects.  ID141 	Caledonian Mercury 	Edinburgh 	Scotland 	United Kingdom 	1819 	05 	27 	inform 	Extract of a letter from William Hunt, esq. To H. Hunt, esq. Washington Hotel, New Orleans, Dec. 25. 1818. My Dear Brother – We arrived safe in the mouth of the Mississippi on the 10th of this month, after a voyage of 82 days from Gravesend. Your son and myself are in excellent health, and very happy. There are 35 English vessels from Liverpool now here, and a great many English emigrants from Yorkshire, Nottinghamshire, Lancashire, Wiltshire, Hampshire, and Somersetshire ; and, in fact, from almost all parts of the heavily-taxed island we have left behind us ! Our ship was detained near a week in the river, about 80 miles below New Orleans ; we all went on shore, and had plenty of rabbit shooting. I killed the most with my double-barrelled gun, by Knock, corner of Fetter-lane. Henry, myself, and Mr Blake went one day into the woods to kill deer, by night coming on, we lost our road ; and, differing in opinions, we separated, Henry and Mr Blake taking one road, and myself the other. I reached the ship (about five miles) at ten o'clock ; but they remained lost all night in the woods, and did not return to us till the next morning. It being wet, and Henry sleeping on the marshy ground, in spite of the remonstrances of Mr Blake, caught a severe cold, and suffered much with rheumatic pains for four days, but he is now perfectly recovered : he is grown fat. In the river there are thousands of wild swans, wild geese, wild ducks, woodcocks, snipes, and other wild fowl. If you were there, you would kill a waggon load in a day, as I know you have frequently killed a horse load in England ; but they are a thousand times more numerous here than I ever saw them in England ; this market swarms with them, and very cheap. No game certificate required here. Myself, Henry, Mr Blake, and the other passengers, visited a French farmer, about six miles below New Orleans : he has got 3000 acres of his own land, whereon are sugar plantations, sugar-houses, & c. ; he made 250 hogsheads of molasses of sugar last year. He offers five hundred acres of good land with his pretty daughter, as a fortune on her marriage. There are plenty of French settlements on the banks of the Mississippi ; but they are the most slovenly and the worst farmers I ever saw. – They are very lazy, bad managers, and appear to use their negroes very cruel, and work them very hard. The Europeans generally leave New Orleans in the summer, as it is very unhealthy in the hot weather and the deaths are frequently seventy in a week. The scenery of this country is very picturesque ; it is very much like the banks of the river Thames about Richmond and Staines, and many of the buildings are as handsome as those of Bath. Here is one Church, which is a very beautiful building. On Sunday the French and Spanish shops are all open, and it is a market during the whole day ; balls and the theatre open in the evening, gambling & c. We are at the Washington Hotel, the best in the city ; it is expensive, although very good living here : we pay ten dollars a-week each, including claret and rum and water. There is no beer here in warm weather as in England, and it is as warm here now as it was in England in July, although not half so oppressive and stinking as it was in Covent Garden during the election : 60 persons dine and sleep in this hotel, most of them English. We do not trouble ourselves about politics in this country ; our object is to cultivate the soil, and to reap the fair reward of our labour. On Saturday we were charged 100 dollars each for passage, and four dollars six cents for every hundred weight. We have three and a half tons weight with us. Do pray send me four quarters of the best peas, rye, grass seed, and some more of Hill's Scots ploughs, to be left at Messrs Brown and Co. who will forward them carefully to me at the Illinois. Mr Trimmer, an Englishman, has purchased 20,000 acres of land near Mr Birkbeck, and has taken twenty couple of hounds with him, so that we shall have some hunting as well as shooting if we like. It is said that he is about to marry one of Mr B.'s daughters. He is now here : he tells me that there are plenty of English farmers settled all over the Illinois territory. He is here to get labourers ; they are the only thing wanting there. I should have brought over some with me, but they may follow us ; as I understand the labourers, with the pay of a dollar a day, can live better than a Hampshire or Wiltshire renting farmer of L.300 or L.400 a year. Mr Riply, and others that I have seen from Illinois, report that the farmer can get a sure profit the first year. Mr Ripley says there is a good sure market, and a fair profit and only one penny per acre land tax ; this is all the taxes we shall have to pay. Price of labour is very dear here ; we pay a dollar for washing every dozen of shirts, cravats, pocket handkerchiefs, & c. & c. The price of a gallon of best rum is one and a half dollar. The custom-house duty on my things shipped from England, I have paid 92 dollars for. Although I should like England very well if it was not for the taxes, yet, from what I have seen hitherto, I like America ten times better  ID317 	Glasgow Advertiser 	Glasgow 	Scotland 	United Kingdom 	1792 	04 	27 	inform 	Richmond, January 28. Extract of a letter from a Gentleman now residing at Quebec, to his Correspondent in this City, dated Jan. 9, 1972 Our humanity was deeply affected by the dreadful carnage made by the Indians. You may be assured that the number of Indians did not exceed 1000, and that nothing saved General St. Clair, and the remainder of his army, but the great quantity of plunder he left to the Indians; they were composed of various tribes, and three-fourths of of them remained in the camp to plunder it, and to take scalps, the trophies of their victory; and he that got most when he returned to his nation, acquired the greatest share of glory; hence only about 200 pursued. The loss of the Indians is under 20 killed and 30 wounded. The victory they have obtained at so easy a purchase, and the riches they obtained by the plunder, and the provisions they found, will make them a more terrible foe than ever they have been; they boast of taking an amazing quantity of powder and arms, which they wanted; many of them were only armed with spears and hatchets, and I have no doubt but if another expedition should be set on foot, that they will be met by three times the number of Indians. The indian tribes of nations who live many hundred miles back have all entered into an association, and made the present war a common concern, they to oppose what they call the common enemy. The warriors of the different tribes so united are not less than 15 or 20,000; numbers of the chiefs of ten or twelve numerous nations were here last summer. Lord Dorchester advised them to make peace, and offered his mediations; he told them he was at peace with the United States, and could give them no assistance. Their answer was, that the enemy was in their country, and would not make peace with them, but on term dishonourable, and at the expense of their country, and that they had determined to die before they would accept of such terms. They felt much dissatisfied with the answer they received, and departed with a full determination to defend their country with the last of their blood. You may depend on it, that many years will elapse, and many thousand men be expended before the United States will, by the present measures, be able to possess the country in contest; and I may also add, that I have great apprehensions, that desolation and destruction will be the consequence on the frontiers of the Ohio this winter and next spring; I would to God some steps might be taken to prevent them. I have no doubt the country might be purchased for one fiftieth part of the expence already incurred by the different expeditions; the attempt to take the country from them by force, is founded in unrighteousness, and ought to be abandoned; besides, if the American mean to have anytrade with them, they are taking steps that will prevent it for many years to come. The Indians do not easily forget or forgive injuries Carlisle, Jan. 4. 1792. By the Pittsburgh post which arrived yesterday, we are informed, that previous to his leaving Pittsburgh, an express had arrived there with the melancholy news that Forts Jefferson and Franklin were taken by Indians, and that two large bodies of them were moving to the Allighany. Extract of a Letter from Patowmack, North Amer ca, Feb. 7. Last Sunday evening came to this town a young man from Cat-fish, which he left about two weeks ago, and who gave us the following pleasing interesting, and important intelligence, viz, that two days before he left Cat-fish, two men arrived there from Licking, who informed, that they had been out with a body of 1300 volunteers on horseback from Kentucky, under General Scott; that they left Licking on the expedition a few days before Christmas; that General Scott dispatched three spies in advance, who, when they arrived about 13 miles beyond the spot where General St. Clair was defeated they discovered a large body of Indians diverting and enjoying themselves with the plunder they had taken, riding the bullocks, dancing, &c. and appeared to be mostly drunk; that on the information being given to General Scott, who, with the main body, were a few miles in the rear, he divided them into three divisions, advanced, and fell on the enemy by surprise; that the contest was short, but victorious, on the side of the volunteers, 700 of the enemy being killed on the spot, all the cannon and stores in their possession retaken, and the remainder of that savage body put to flight; that General Scott, having lost but six men, returned to Licking in triumph, with most of the cattle, stores, &c. leaving the cannon at Fort Jefferson; that General Scott had previously gone out with 400 men, but finding his number was insufficient, was returning but met a body of 900 volunteers when, upon joining him, he immediately proceeded in prosecution of his original design which fortunately proved successful. Our informant further adds, that he saw a Kentucky newspaper of the 8th of January, at Morgan Town, brought by Major Scott's expedition, which corresponded with that given by the two men at Cat Fish, and that Gen. Scott brought in near 700 scalps.  ID367 	Glasgow Herald 	Glasgow 	Scotland 	United Kingdom 	1822 	01 	28 	inform 	Extract of a letter from an Englishman, dated Lima, Septemper 10, 1821 Lima is what an Englishman would call a dirty colonial town; 6000 inhabitants is the outside of its population; the whites are about 1200 Europeans, and not as many born in the country; the rest are blacks and mulattoes. Of the mulattoes there are eight various shades. I never saw such a wretched herd as Lima incloses; more poverty and misery than in any town of the size in the world.– There are some few splendid houses, but the rest so disgustingly filthy that you cannot go into them without being covered with dust and vermin. The streets, as in all American towns, run at right angles; a powerful stream of water in each; the town is capable of great improvement. The climate must be bad, for the whole population look as if turned out of the hospitals for a day's air; a half-born race–melancholy in their faces. On the whole coast of Peru we made the same observation; the ague very general, with fever–their habits and manner of living increase the evil; thin clothing and vegetable diet–nights very cold –I sleep under a heavy blanket, and could bear another; a thick fog prevents the sun from coming out in winter; the heat however is not excessive during summer; on the whole not an oppressive climate, if the people had any idea of living in a rational way. Very few families cook at home℃they buy their greasy messes boiled in the streets, in pulperias, and in the squares; not six families in Lima that have wine on their tables; they drink brandy at all hours, and excuse themselves for not having any thing that is expensive by saying it gives the ague; the same person who denies himself a glass of wine will lay twenty doubloons on a card in the evening. Their money goes in gambling, debauchery, and dress; every woman, high and low, has her price; a lady takes no offence at her frailty being exposed; she tells you she is quite at good as her neighbours, and needs be no better. The Spanish nation and Government are the cause of all the degradation of South America; every Viceroy, from Pizarro to Pezuela, was a plunderer, a teacher of immorality in words and deeds. The miserable state of this people seems incredible–one must see to believe it; scarcely a young lady can read or write, or use a needle; few houses that the Devil has not appeared in; and a devout lady is accompanied in her carriage by the Virgin Mary. Thus is ignorance imposed upon by knaves; as to priestcraft, it reigns here in all its glory; a third part of Lima is covered with churches, some of them very splendid. The whole trade of this part of Peru depends on the single mine of the mountain of Pasco for returns; if this is worked to advantage, it will produce six millions of dollars; but if the country is disturbed by war, not a dollar will they have. The exports of Peru, in ordinary times, were five millions of dollars in pecie, and one million in produce. Mininng may be carried to any extent, it is true; but this requires tranquillity and good government. People in Europe have the most erroneous ideas or Peru; every traveller and historian who has written or talked about it ought to be made to stand in the pillory for a liar. Arica, the second port of Peru, and the great outlet to Upper Peru, is a wretched village of hovels covered with mud–about 400 Mulattoes and Indians–placed on a sand bank–the people all in the ague–not a boat or ship of any sort. The harbour-master came off on bulsa, (two bladders lashed together,) paddled by an Indian. We could not get a basket of fruit or vegetablse for money. Their cultuvation was three leagues off, but they were too lazy to fetch any thing, though a seventy-four and a frigate lay-to twnety hours, offering them any price for their tropical fruits. I hire a small room for 12 dollars a month, and sleep on the ground; borrowed a chair, and bought some crockery. No such thing as a tavern; never was. Letters of no use; no one asks me to his house. I go to bed at eight o'clock to kill time. A play twice a week; the most fashionable ladies stand up in the front boxes, and light a segar by the chandelier; the house filled with smoke. There are 82 titled families, mostly idiots–all reduced to poverty by the emancipation of their slaves. If the war be continued a year, Peru will be the most wretched country on the globe; indeed the Indians will regain their empire, and exterminate all other colours. the number of blacks in the viceroyalty is estimated at seventy thousand– 25,000 in Lima and adjacent village, the total population of Peru about three millions–three-fourths Indians. About the town there are many fine gardens with pretty country houses. Provisions of all sorts excellent, and in the greatest variety; fruits of all climates in the marketplace, the produce of the sea-shore and the Cordillera.– Beef and mutton excellent–the chief supplies come from Janja and other vallies in the Cordillera. The sea-shore produce is continued to little vallies badly cultivated; those about the town would disgrace the free negroes of Carolina. Most valuable land a league from the town, half cultivated and half abandoned; every thing left to starved slaves; such famished objects I never beheld; no other hands to cultivate. When emancipation becomes general, they will not work, and famine must ensue.  ID385 	Glasgow Advertiser 	Glasgow 	Scotland 	United Kingdom 	1789 	11 	27 	inform 	The Americans wished to give the title of Highness to General Washington, a President of the Congress, but the hero rejected the offer, saying, that the title he already held, was fully equal to his ambition.  