Article ID 	Newspaper Title 	Newspaper City 	Newspaper Province 	Newspaper Country 	Year 	Month 	Day 	Article Type 	Text 	Keywords
        ID87Glasgow AdvertiserGlasgowScotlandUnited Kingdom17910523informQUEBEC, December 2, 1790 Yesterday's post from Montreal, conveyed letters to several gentlemen in town, all corroboratiing the following extract. SIR, I have to inform you by several letters received here on Saturday from Detroit, we are informed the Americans, under General Sinclair, had been twice defeated, about the 19th ult. with the loss of from 500 to 600 men, by the Indians The Indians first attacked a body of 300 horse which they had drawn into a snare, and cut the whole of them off. In a second engagement, they were likewise victorious, having nearly killed as many. On account of which, Sinclair thought proper to retreat; and the last accounts state the Indians having divided themselves into small parties, had so harrassed him, that he was obliged to leave the wounded in the field–Sinclair lost his artillery, a cohorn, and grass-hopper. It is said the Indians are very much elated at their success, and that numbers were daily joining them, at their head quarters, about the Maimis towns– One Indian, it is said, killed 30 with his own hand. The Indians were extremely civil to the traders from Detriot, having assisted them, when they knew of the approach of the Americans, to remove their property to safety, except ammunition and arms. These are facts so well ascertained, that there does not remain the least doubt of them: They may be attended with very serious and important consequences to the province, as I dare say, all will be imputed to the British for supplying these Indians with arms and ammunition.– In short, I would not be surprized to hear of an American army raising, to attack this country. * The loss is here specified, but other letters differing in number, we shall only say, the estimate in general does not appear considerable. Native Americans
        ID318Glasgow AdvertiserGlasgowScotlandUnited Kingdom17910627informThe unsettled state of a great part of the Westtern Frontiers of America (if we can suppose that there are any determined frontiers when the settlers are making large and continual encroachments) must very much depreciate the sale of lands in those parts, notwithstanding the very small rates of purchase demanded for vast extents of ground, and the soil being remarkable fertile and productive. The ineffectual attempts of last summer to prevent the future depredations of the Miamis, and some other tribes of Indians, and the barbarities before and since committed on the setlers, must occasion other people to be very cautious of removing to places where they would hold their lives and property on a very precarious teure, unless the arms of the State prove remarkably successful in their future attacks. Native Americans
        ID319Glasgow AdvertiserGlasgowScotlandUnited Kingdom17910502informNassau, New England, March 12. The red bugs, which did so much injury to the cotton last year, have again made their appearance, but not in such numbers as was first expected. The hops in many States of America have been particularly productive. A letter from Great-Ogreechee, in Georgia, dated December 9th, says, since the completion of the treaty with the Creeks, all has been very quiet, unless we except some ill-natured state - bickerings and heart-burning amongst ourselves, chiefly occasioned by a few influential men, who find themselves great losers by a general act of common justice towards the Indians. These, however, we expect, will subside by degrees; notwithstanding the formidable combination in a certain part of the State. As to the Creeks, Siminoles, and other nations adjoining our Western frontier, nothing is clearer than that, so far from being injurious to us, they may henceforward be made useful to the real interests of this State, provided the faith of treaties be observed. They now show every disposition to copy our manners, arts, agriculture, and mode of living. agriculture;Native Americans
        ID320Glasgow AdvertiserGlasgowScotlandUnited Kingdom17910304informMr. Bowles, the Cherokee Chief, proposes to introduce the art of Printing amongst the Indians, with whom he resides; and, for this purpose, has engaged two persons to accompany him on his return, and has provided himself with all the implements of the art. The day fixed for their departure is the 20th of March The Indian companions of Mr. Bowles are two Creeks and two Cherokees. these nations, though contiguous to each other, and in strict union, differ as essentially as possible in language and manners. Both, however, entertain the most implacable animosity against the Spaniards, whose authority and dominions in South America they make no scruple of avowing they mean to try to diminish. Native Americans;Spanish Empire
        ID323Glasgow AdvertiserGlasgowScotlandUnited Kingdom17911108informExtract of a letter from a Gentleman in Muskingum to his Friend in the City of Norwich, (Connecticut,) dated Nov. 24, 1790. The prospect of peace from our frontiers, seems to me to be vanished for the present; the troops from this garrison have this morning returned, and the best account I can collect of the expedition is as follows: viz. the troops amounting to about 1200 militia, and about 300 regulars, after seventeen days march from Miami, reached the great Miami village, about 170 miles, without any molestation, except having a number of their pack-horse stole.–On their arrival they found the village deserted, and all the valuable builder a short tarry, they proceeded to neighings set on flames by the Indians. Afbouring villages, without molestation, and deftroyed five of them, and a quantity of corn, computed at fifteen thousand bushels, which they found buried in different places, and very large quantities of vegetables of every kind. The first opposition that was met with, a party of about 150 Kentucky militia, and thirty regular troops, all under the command of Col. Hardin, of Kentucky, were detached from the main body, lying in the great Miami village, to pursue the track of a party of Indians which had the day before been discovered. After a pursuit of about six miles, they came up with, and were attacked by surprise, by a body of Indians, who were concealed in the thickets on every side of a large plain; and on the first onset the militia, without exchanging a single fire, made a most precipitate retreat, and left the regular troops to stand the whole charge of the Indians; the conflict was short and bloody; the troops were soon overpowered by numbers, and all fell, except the two offiers and two or three privates, after defending themselves at their bayonet points with the greatest possible obstinacy. Ensign Hartshorn, of Franklin, was one of the four that escaped, and his escape appeared to depend on a more luckly circumstance of falling over a log in his retreat, and by that means screening himself from the eye of his pursuers, that from any other circumstance. Captain Armstrong, who commanded the party, likewise made his escape, by plunging himself into a pond or swamp, up to his neck, within two hundred yards of the field of action, where he remained the whole night, as a spectator of the horrid scene of the War Dance, performed over the dead and wounded bodies of the poor soldiers that had fallen the preceding day, where their shrieks, mixed with the horrid yells of the savages, rendered his situation shocking. After this, some few skirmishes succeeded, but nothing material, until the second capital action, which happened two days after the army left the Miami village. At ten miles distance from the town, the General ordered a halt, and detached from four to five hundred militia, and about sixty regular soldiers, commanded by Major Wylls, all under the command of Col. Harden, with orders to march back to the town. On their first entrance into the town, there appeared a small body of Indians, who immediately fled at the first onset, and by that means decoyed the whole body of militia, by making their flight into different directions, and encouraging the militia to pursue; by this means the regular troops were left alone, and the Indians had effected their design; for the moment they found the small handful of regular troops detached from the main body of militia, they commenced the attack with their whole force, excepting the flying parties that had diverted the militia; and although they soon found some part of the militia returning on their back, pursued their object of routing and destroying the troops; as the only sure plan of success; which, after the bloody conflict on each side, they effect. The regular troops, all to nine, including two commissioned officers, were killed and disabled, and a total defeat ensued. Among the slain were Major Wylls, of Hartford, and Lieut. Frothingham, of Middletown. Of the militia, it is said, about an hundred were killed, among whom were a number of brave and valuable characters. The Indians, it appears, from some cause, did not think it prudent to pursue their successes from the field of action, for most of the troops that were not killed, or sorely wounded, made their escape, which they never could have done had the Indians pursued with their usual fury. Nothing can exceed the intrepidity of the Indians on this occasion; the militia they appeared to despise, and with all the undautedness conceivable, threw down their guns, and rushed upon the bayonets of the regular soldiers; a great number of them fell; but being so far superior in numbers soon overpowered them, for while the poor soldier had his bayonet in one Indiaman, two more would sink their tomahawks in his head. The defeat of our troops was complete, the dead and wounded were left on the field in possession of the savages. No damage, of any consequence, has been sustained in this part of the country from the Indians; but what effect the expedition may have on us, as relates to our frontier, it uncertain.– If the Western Indians have any idea of treating for peace, we shall be safe; if not, we are much exposed. war;Native Americans
        ID324Glasgow AdvertiserGlasgowScotlandUnited Kingdom17910121informExtract of a letter from Norfolk (Virginia), Oct. 26. We learn from the West Country, that the Kentucky Convention has determined in favour of a separation, and large preparations are making in the country for offensive operations against the Indians, who have committed so many murders, and harassed the country so much, that it can no longer be endured. Such devastation may shortly be expected to take place,that the name of a Shawenese nation will be no more. that on this side the Cumberland mountains, please prospects are in view; a general peace is likely to take place with the Southern Tribes; a regular and efficient system of government is about being established under the auspices of Congress: one of the mildest seasons in a temperate and salubrious climate, with the most exuberantharvest, gives joy to the husband, and animates the diligence and industry of all. Extract of a letter from a Gentleman on the Ohio. Since my last, the Gentlemen I mentioned to you are forming themselves into a Company, for the purpose of building three vessels of force, amounting from twenty to forty 24 pounders, completely manned and quipped. They purpose loading with tobacco, flour, &c. and proceed tos ea by the gulph of Mexico, with a full determination to punish severely every insult which, in violation of treaties, may be offered to the American flag, sailing down the Mississippi. It is generally supposed they will embark between twelve and fifteen hundred men, in orto??? America's??? to the navigation of the Mississippi. war;Native Americans;colonial government;agriculture;filibustering
        ID327Glasgow AdvertiserGlasgowScotlandUnited Kingdom17910207informCONGRESS. Wednesday, Dec. 8. The SPEECH of George Washington , Esq; President of the Congress, on??? the ??? Fellow Citizens of the Senate, and House of Representatives, I N meeting you again, I feel much satisfac tion on being able to repeat my congratulations on the favourable prospects which continue to ditinguish our public affairs. The abundant fruits of another year have blessed our country with plenty, and with the means of flourishing commerce. The progress of the public credit is witnessed by a considerable rise of American stock abroad, as well as at home; and the revenues allotted for this and other national purposes, have been productive beyond the calculation by which they were regulated. This latter circumstance is the more pleasing, as it is not only a proof the fertility of our resources, but as it assures us of a further increase of the national respectability and credit; and let me add, as it bears an honourable testimony to the patriotism and integrity of the marine part of our citizens. The punctuality of the former in discharging their engagements has been exemplary. In conforming to the power vested in me by acts of the last session, a loan of 3,000,,000 of florins, towards which some provisional measures had previously taken place, has been completed in Holland.–As well theexchange with which it has been filled, as the nature of the terms (considering the more than ordinary demand for borrowing, created by the situation of Europe) give a reasonable hope that the further execution of those powers, may proceed with advantage and success. The secretary of the treasure has my direction to communicate such further particulars as may be requisite for more precise information. Since your last sessions, I have received communication, by which it appears, that the district of Kentucke, at present a part of Virginia, has concurred in certain propositions contained in a law of that state, in consequence of which the district is to become a distinct number of the Union; in case the requisite sanction of Congress be added. For this sanction application is now made. I shall cause the papers on this very important transaction to be laid before you. The liberality and harmony with which it has been conducted, will be found to do great honour to both the par ties; and the sentiments of warm attachment of the Union and its present Government, expressed by our fellow-citizens of Kentucke, cannot fail to add an affectionate concern for their particular welfare, to the great national impressions under which you will declare on the case submitted to you. It has been heretofore known to Congress that frequent incursions have been made on our frontier settlements by certain banditti of Indians from the north west side of the Ohio. These, with some of the tribes dwelling on and near the Wabash, have of late been particularly active in their depredations; and, being emboldened by the impunity of their crimes, and aided by such parts of the neighbouring tribes as could be seduced to join in their hostilities, or afford them a retreat for their prisoners, and plunder, they have, instead of listening to the humane invitations and overtures made on the part of the United States, renewed their violence with fresh alacrity and greater effect–The lives of a number of valuable citizens have thus been sacrificed, and some of them under circumstances peculiarly shocking, whilst others have been carried into a deplorable captivity. These aggravated provocations rendered it essential to the safety of the western settlements, that the aggressors should be made sensible that the government of the Union is not less capable of punishing their crimes, than it is disposed to respect their rights and rewards their attachments. As this object could not be effected by defensive measures, it became necessary to put in force the act which empowers the President to call out the militia for the protection of the frontiers; and I have accordingly authorised an expedition, in which the regular troops in that quarter are combined with such drafts of militia as were sufficient. The event of the measure is yet unknown to me, The Secretary at War is directed to lay before you a statement of the information on which it is founded, as well as an estimate of the expence with which it will be attended. The disturbed situation of Europe, and particularly the critical posture of the great maritime powers, whilst it ought to make us more thankful for the general peace and security enjoyed by the United States, reminds us at the same time of the circumspection with which it becomes us to preserve these blessings. It requires also that we should not overlook the tendency of a war, and even of preparations for war among the nations most concerned in active commerce with this country, to abridge in means, and there by enhance the prince of transporting its valuable productions to their proper markets. I recommend it to your serious reflections, how far and in what mode it may be expedient to guard against embarrassments from these contingencies, by such encouragements to ur own navigation as will render our commerce andagriculture less dependant of foreign bottoms, which may fail us in the moments most interesting to both of these great objects. Our fisheries and the transportation of our own produce, offers us abundant means for guarding ourselves against this evil. Your attention seems to be not less due to that particular branch of our trade which belongs to the Mediterranean. So many circumstances unite in rendering the present state of it destresful to us, that you will not think any deliberations misemployed which may lead to its relief and protection. The laws you have already passed for the establishment of a judiciary system, have opened the doors of justice to all descriptions of persons. You will consider in your wisdom, whether improvement of a judicatory system, have opened the doors of justice to all descriptions of person. Yu will consider in your wisdom, whether im provements in that system may yet be made, and particularly whether??? ???process of execution on sentences issuing from the Federal Courts, be not desirable through all the States. The patronage of our commerce, of our merchants and seamen, has called for the appointment of Consuls in foreign countries. It seems expedient to regulate by law the exercise of that jurisdiction and those functions which are permitted them, either by express convention, or by a friendly indulgence in the places of their residence. The Consular Convention too, with his most Christian Majesty, has stipulated in certain cases, the aid of the National authority to his Consuls established here. Some legislative provision is requisite to carry these stipulations into full effect. The establishment of the Militia, of a Mint, of Standards of Weights and Measures, of the Post Office and Post Roads, are subjects which (I presume) you will resume of course, and which are abundantly urged by their own importance. Gentlemen of the House of Representatives, The sufficiency of the revenues you have established for the objects to which they are appropriated, leaves no doubt that the residuary provisions will be commensurate to the other objects for which the public faith stands now pledged. Allow me moreover to hope, that it will be a favourite policy with you, not merely to secure a payment of the interest of the debt founded, but as far and as fast as the growing resources of the country will permit, to exonerate it of the principal itself. The appropriation you have made of the western lands explain your dispositions on this subject, and I am persuaded the sooner that valuable fund can be made to contribute, along with other means, to the actual reduction of the public debt, the more salutary will the measure be toe very public interest, as well as be more satisfactory to our constituents. Gentlemen of the Senate, and House of Representatives. In perusing the various and weighty business of the present session, I indulge the fullest persuasion that your consultations will be equally marked with wisdom, and animated by the love of your country. In whatever belongs to my duty, you shall have all the co-operation which an undiminished zeal for welfare can inspire. It will be happy for us both, and our best reward, if by a successful administration of our respective trusts, we can make the established government more and more instrumental in promoting the good of our fellow citizens, and more and more the object of their attachment and confidence. (Signed) GEORGE WASHINGTON. United States, Dec. 8 1790. international trade;taxation;war;Native Americans;agriculture;colonial government;foreign relations
        ID328Glasgow AdvertiserGlasgowScotlandUnited Kingdom17910121informThe following, it is said, are the authentic particulars of General St Clair's expedition in America. The Miamis Indians had been for a long time extremely troublesome to the Americans, and it was determined to drive them to the back country. General St. Clair completely accomplished this object; but on the 22d Oct. a detachment of 400 Americans fell in with the Indians on the River St. Joseph, where a severe battle was fought. Many Indians were killed, but the Americans lost the field; several Officers, and 150 men were killed, and they were not able even to bring off their wounded. This success will in all probability give the Indians new courage, and induce them again to make head against the American army. Native Americans
        ID329Glasgow AdvertiserGlasgowScotlandUnited Kingdom17910131informExtract of a letter from Boston, New England, Dec. 11. The demands for the produce of America are most rapidly increasing: one single house has actuallyexported and sold, within a very short time, 2000 barrels of pot and pear ashes, 2000 barrels of beef, 500 ditto of pork, 70,000lb. weight of butter, and 1500 bushels of bean and peas. Our news from New York is very disagreeable indeed. Gen. Scott, Major Fountain, Major Willis, Capt. M'Murtry, and Lieut. Fortingham, have all fallen sacrifices to the Indians, after a terrible conflict on the banks of a river; there were such numbers of the Indians killed,and thrown into the river, that their dead bodies actually stopped the current of it. The frost is very intense at New York During the late gales of wind, the smugglers have been uncommonly active on all the coasts of the kingdom. The risk of their lives secured their property–for the Custon-house boats were afraid to follow them. From many parts of the country we have received accounts of the land being entirely flooded by the late heavy rains. A prisoner who was tried last week try town sessions, for stealing iron, being acquitted by the Jury, addressed them in the following words: Gentlemen, I most sincerely thank you for your lenity, and promise never to be guilty of the like offence again. international trade;Native Americans;crime
