Article ID 	Newspaper Title 	Newspaper City 	Newspaper Province 	Newspaper Country 	Year 	Month 	Day 	Article Type 	Text 	Keywords
        ID330Glasgow AdvertiserGlasgowScotlandUnited Kingdom17910107entertainNew-York Oct. 11. We are informed that the census of Philadelphia is completed, and that the city is found to contain fifty three thousand inhabitants. A Petersburgh (Virginia) paper of the 30th ult. informs the public of that state, that a serious petition is now drawing up, to be presented to the next congress, stating arguments in favour of polygamy, from the plain principles of reason; and praying that a man may legally marry two wives. This, it is thought, will be the most effectual means to extirpate the numerous race of old maids, and increase the population of the United States. The petition is to be presented by a gentleman residing at Cabin Point. Oct 12. In one of the Charleston papers of the 16th ult. appears the epistle from the yearly meeting of the Quakers in London, to the friends in Great Britain, Ireland and America. It is remarkable that in the re-publication of this episstle in the Carolina paper, the whole paragraph relative to theslave trade and negro slavery is omitted. Oct. 13. The ship Betsy, Rook, arrived on the 6th instant, at Wilmington, Delaware,, from Londonderry, in Ireland. This vessel brought in a large number of Irish emigrants, some of them people of property; who, weary of the patronage of their old tutelar saint, St. Patrick, have come to settle themselves and their posterity in America, under the more liberal auspices of St. Tammany. The following letter was written from a young heir to the Probate Judge–Sir–My father departed this life not long hence, and has left a widow and five scorpions. I understand he died deetested and made me executioner, but as the estate is like to prove insolent, I was told that as you was Judge of reprobates, you must send me a letter of condemnation. And as in duty bound ??? ??? pray, &c. Extract of a letter from a gentleman, in the county of Lincoln, Massachusets, dated Sept. 14. We have had a very wet season here since you went from us, and the grass hoppers are innumerable; they have eat up all the gardens, and all the grass; of course, as the natural consequences, we have no milk, neither shall we have any beef or butter this season; the corn has also suffered very much from those insects Extract of a letter from Banbury (Georgia) Sept. 20 A firm peace being now, to all appearance, secured between the United States and the Creek Indians, we may reasonable expect that the state of Georgia will soon begin to feel the good effects. The immediate beneficial consequences are already at this moment taking place. The vast tracts of fertile lands on both sides of the Altamahaw river are rapidly rising in value, and nothing is wanting here (to compensate for the scarcity of slaves) but a hardy and industrious race of men, who instead of being mere lookers on, in quality of overseers and drivers, would condescend to put their own hand to the axe or grubbing hoe, and make this extensive territory one of the most desirable in the habitable world. The country round Sapola Sound and the mouth of Altamahaw, is one of the most beautiful you can imagine,abounding with everything that can make life comfortable, besides an excellent navigation and easy bar at the north end of Sapola, with rather more water than that of Charleston. Several vessels are hourly looked for from France, (one in particular of 800 tons from Bourdeaux) to load with live oak ship timber and??? in the river of St. Mary's. Extract of a letter from Hampton (Virginia) Sept. 25. There are two articles produced in the greatest abundance on different parts adjoining James river, the exportations of which, in the opinion of rational men, ought to be considered as of the greatest importance to this state. These articles are coals, and clays for the several colours of paint, which may be had in any quantity, and may be afforded at moderate prices. The mines of coal, from every discovery we have been able to make, are inexhaustible; all the samples, however, that you have yet seen are mere pickings up on the surface, and there is reason to believe that the deeper we shall descend the better will be the quality of the coal. When once a company can be estblished with funds sufficient to take this matter in hand, there is no doubt but that we can supply the different capital of the United States with coal equally good with that from Europe, and at a much a more moderate price than that frequently brought. As to our paints, there are none better in the world, and in quantity, when manufactured. Several gentlemen in the country up the river, of property and enterprize, are beginning to turn their attention to these branches; and with all submissions to our legislature, it is thought that these two articles are by no means objects beneath their attention. Extract of a letter from Charleston, Sept. 27. On Sunday last weas launched at Mr. Pri?chard's ship yard, Hubcaw, a fine new brig, calculated to carry 700 barrels of rice, the property of Mr. Hary Grant, and is to be called the Pringle. A number of spectators collected from the city to view the pleasing sight, with which they were no less delighted, than with the liberal en tertainment and polite attention of Mr. O???. Boston, Sept. 28. Yesterday sailed from this port, the ship Columbia, Capt. Robert Gray, on a circum navigation voyage to the North-West coast of America.–This is the second voyage the Columbia has made to our coast–too much praise cannot be given to the gentlemen, owners of the ship, for their exertion in extending the commerce of America. The native of??? has returned to the place of its nativity. Dr. FRANKLIN Never declare yourself the author of a???, without being, beyond doubt, certain of???, was the Doctor's advice. He generally enforced his percepts by giving an example. I had been with a number of my acquaintance taking the diversion of a dance at an inn. The fiddler stepped out to get some refreshment. the tavern keeper came in and advised us in a very warm manner to make a collection for the fiddler who had been scraping his cat gut several hours in our service; we apparently agreed, and he well pleased with the success of his persuasion, went for his hat to collect what we were willing to give. We took up an old newspaper, tore it into small pieces, which we carefully folded and put into our pockets. The tavern keeper goes round the room, and we, very gravely, drop our paper in his hat. The fiddler returns, and the landlord with a cheerful face and an air of self approbation, boasts of what he had been doing for him; It was I persuaded them to make the collection, I made them give, I went round to every one, and see what I have got. If it had not been for me–the fiddler examines his prize, and discovers the cheat–he vents all his anger upon the poor landlord's shoulders, who thus suffered for proclaiming himself the author of a project before its success was fully ascertained. census;reprinting;slavery;shipping;emigration and immigration;war;Native Americans;slavery;mining;shipping;international trade
        ID331Glasgow AdvertiserGlasgowScotlandUnited Kingdom17910718informA letter from Philadelphia???, that the most active preparations were making ??? ??? of the United States for recommencing the war with the Miami Indians. Upwards of 1000 volunteers had been raised in the States of Pennsylvania, Jersey, and Delaware, in the course of six weeks, and rendezvoused at Fort Pitt, from whence they were to commence their warlike oeprations. Native Americans
        ID333Glasgow AdvertiserGlasgowScotlandUnited Kingdom17910624informThe Indians, on the borders of Kentucky, continue to commit the most horrible acts of cruelty upon such unfortunate Americans as fall in their power. The burning of the Miami villages, and the destruction of their corn and vegetables, instead of intimidating those ferocious savage, have made them more and more vindictive and restless; and being acquainted with all the passes in the country, they bid defiance to their pursuers, whom they frequently surprise and cut off. Native Americans;war
        ID334Glasgow AdvertiserGlasgowScotlandUnited Kingdom17910110informFrom the New York Journal. Winchester, Oct. 20. By recent intelligence from Kentucky we learn that a short time ago an American vessel was seized at New Orleans, and her cargo disposed of by the Spaniards. Also, that the troop which went out against the Indians had, not far from the banks of the Ohio, fallen in with about forty of them, whom they made their prisoners, after a slight resistance; and that having washed them, 15 turned out to be white men. Philadelphia, Nov 9. We hear from undoubted authority, that a considerable loan has been negotiated in Holland for the service of these United States. Albany, Nov. 4. The Legislature of Vermont have resolved to pay to the State of New York 30,000 dollars, agreeably to the first proposition contained in the declaration of the Commissioners of this State, appointed to declare the consent of the Legislature thereof, that a certain territory within the jurisdiction of the State of New York be erected into a new State on the 17th of October last; in consequnece whereof, all rights and titles to lands within the State of Vermont, under grants of the late colony of New York, or from the State of New York (except such grants as were intended as confirmations of those from New Hampshire) cease and determine. The Legislature have also resolved, that a Convention be called for taking into consideration the constitution of the United States; the members to be elected in December, and the Convention to Meet the first week in Jauary. The Legislature have adjourned to meet again on the first Thursday in January, for the purpose (we suppose) of choosing Senators, and affixing the time and manner of electing Representatives for Congress. New York, Nov. 18. The following resolution has passed the House of Representatives of the State of Virginia now in session: Resolved, That so much of this act, entitled, An Act, making provision for the provision for the debt of the United States in their redemption of the public debt, is dangerous to the rights, and subversive of the interest of the people; and demands the marked disapprobation of the General Assembly. Portland, Nov. 15. The stone work of the light house, at the entrance of our harbour, is now completed. On Tuesday the 9th instant, the last stone was laid by Mr. Nichols, of this town, master builder. The work is extremely well executed. The lighthouse is now 70 feet high. To this the lanthorn, which is to be six feet in diameter, will add about 15 feet, 85 feet in whole. The lanthorn is now preparing, and will probably be raised and lighted by the first of next month. Baltimore, Nov. 23. A society of respectable gentlemen of this place have raised an adequate fund for the establishment of an extensive manufacture of gunpowder, and the necessary mill-works will be speedily erected in the vicinity of this town. This important insituation will not only prove highly advantageous to this State and town, but may, if properly encouraged, become a national benefit. York (Pennsylvania), Nov 10. From Wright's Ferry we learn, that about four o'clock on Wednesday afternoon, as a boat was coming from the East side, a most tremendous storm arose when she was about half way over, by which means she was soon filled with water, and sunk. there was six passengers and the??? in her (besides a small light waggon and three horses, viz. a clergyman, the owner of the waggon, with his wife and three children; when the storm came on, the woman and children took shelter in the waggon, but it continued to blow with such violence that the waggon was torn out of the boat, and the body having by chance got loose from the carriage, and being pretty tight, floated some distance till its progress was stopped by a rock; the husband, viewing the melancholy situations of his wife and children, resolved to relieve or perish with them, and quitting the boat swam to the waggon, cut open the cover with his knife, and with difficulty kept their heads above water till they were relieved by a boat from the West side; by this time the ferry-boat had entirely disappeared; the Clergyman just as he found the boat sinking mounted his horse, one of the boatmen mounted on one of the waggon horses, and by this means preserved themselves till they were relieved by a boat; the other boatman of the name of Tim Sulivan, depending on his skill in swimming got up an oar, but it is thought he is drowned, as he has not since been heard of; the boat was found in the falls, and one of the waggon horses that had been given up for lost, was found next day some distance below the falls, with all his geers on, and does not appear to have received the least injury. Extract of a letter from Sunbury, Northumberland County (Pennsylvania), dated Nov. 13. One of the men who murdered the Indians at Pine Creek, was tried on Saturday evening, and though a number of witnesses clearly proved the hand he had in perpetrating the horrid deed, and the confession of his counsel at the bar that confirmed it, yet, notwithstanding an express charge from the judges to bring him in guilty, the jury in a few moments returned with a verdict in his favour, and a subscription to pay the costs of the suit, that he might be immediately set at liberty; and all this from a most absurd idea, which the Attorney General, with all his endeavours, could not beat out of them, that the crime was not the same to kill an Indian as a white man: for some minuets the Chief Justice was mute with astonishment. How the State can pacify the Indians now, Heaven knows, while at this moment the other murderers are at large in this country, and no one will arrest them. shipping;Native Americans;war;colonial government;colonial politics;weather;crime
        ID335Glasgow AdvertiserGlasgowScotlandUnited Kingdom17910509informHalifax, April 6. The late violent rains have done much damage in the country:–The bridge at Sackville is nearly torn down, and the Mill there is much injured: the Bridge at Nine Mills River is partly carried away; and the different roads and causeways are supposed to have suffered more than 2000l. will repair. Since the retreat of the f–eral troops, under General Harmar, the Miami Indians have committed unparalleled cruelties. A large body of them, on the 2d of February, attacked the settlements called Big Bottom, twenty miles from Harman, on the Muilsingam, which they entirely destroyed. Eleven men and two children were massacred, two escaped and three were taken prisoners. Boston. The amount of the value of theexports from the United States, for thirteen months, agreeable to an estimate made at the Office of the Treasury, in 20,000,000 dollars. The greatest apprehensions are entertained of an invasion from our savage neighbours; as accounts from Philadelphia state, that there has been a confederation of all the South West Indians to fall on our frontiers early in the spring. Similiar apprehensions have driven the inhabitants in the country of Marcetta, from their plantations into the city, where they do military duty. According to the late Census, the number of inhabitants in this commonwealth is 470,000. Philadelphia, April 7. Congress met here to-day and made a house, Articles of the Constitution, that were not liked by many of us, are altered much for the better– among other things, we were dissatisfied that not any notice was taken of Religion, as we wanted it expressly declared, that not any sect should ever be established in preference to another.–This is now done. In this part of the world we know not any thing of Toleration–all are equally free. It is said we have land for upwards of an hundred millions of people; we are yet about three, so that,for sometime we have have not any great cause to fight for territory. weather;Native Americans;war;international trade;census;colonial government;religion
        ID336Glasgow AdvertiserGlasgowScotlandUnited Kingdom17910513informThe Indian war in America is now become an object of considerable importance, by the junction of several tribes of Indians, hitherto??? with those already engaged in it. General Washington is expected to take the command of the army intended to serve against them in the present summer. Native Americans;war
        ID347Glasgow AdvertiserGlasgowScotlandUnited Kingdom17910221informRichmond, Virginia, Dec. 1, 1790. Extract of a letter from a Gentleman at Kentucky, to a Member of the General Assembly, dated, Nov. 7, 1790. I have been waiting with much impatience to obtain some certain account of our troops; many probably conjectures still fill the minds of the people. A hand-bill just come to Bourbon, contains an extract of a letter from Governor St. Clair to General Wilkinson, which mentions that our army had met with but little opposition. The Miami villages were abandoned, from thence a detachment was sent up to St. Joseph's river, which fell in with a party of Indians, and had a severe engagement. General Harmar made a shew of retreating, and marched about eight miles, when he detached a strong party to the field of action, in hopes of finding the Indians on the ground; as they expected, so they found them, and an action immediately commenced, which was obstinate on both sides. A vast number of Indians were killed in crossing the St. Joseph's river. Major Fountain, of Fayette, and General Scott's son were killed the second fire; Capt. M'Murty and 73 militiamen were killed; Major Willis, Lieut. Fotheringham, of the F–deral troops, and 77 privates, also fell in the action. General Harmar did not send a single man to reinforce the detachment, consisting of 400 men, (who had to sustain the fire of the whole Indian army) although he had with him in camp upwards of 1100 men. Our men at last lost ground, Colonel Harding's wing was beaten, and finally broke. Lieutenant Colonel Hall, of Bourbon, and Majors M'Million and Willis broke the other wing of the Indians, which occasioned the amazing slaughter in the river St. Joseph. General Harmar never sent to bring off the wounded, nor bury the dead. Captain David Thrope and Lieut. Clark fell in the field. The Bourbon militia has suffered very much, nearly one third of them having fallen on the spot. The army is now at Licking, and is expected home hourly. This is the best account that I have been able to collect; it will be delivered to you by Major Jones, who before he leaves the district, may be enabled to obtain further particulars. Native Americans
        ID348Glasgow AdvertiserGlasgowScotlandUnited Kingdom17910221informMusquito Shore. Intelligence has been received, that in some trivial dispute with a native Indian, a Spaniard has stabbed him to the heart with a stiletto, and then fled. The nation to whom the Indian belonged, being made acquainted with the murder, sent a deputation to the Governor, demanding that five Spaniards should be instantly delivered up as an attonement. This was peremptorily refused, as being more than commensurate to the offence, but the murderer was offered as a satisfaction; the Indians would not accept him singly, and departed, vowing the severest revenge: a few days afterwards intelligence was received that they had surprised and massacred sixteen men, who had been at work in the woods; and when the vessel departed, the Spaniards were flying, with the utmost precipitation and terror, from all parts of the country, seeking shelter in the forts. Native Americans;crime
